Instrument,Company Event Type,Event Title,Event Start Date,Event Last Update Date
NVDA.O,ConferencePresentations,NVIDIA Corporation at JPMorgan Tech Forum in conjunction with the 2009 International Consumer Electronics Show,01/08/2009,2009-01-08T17:00:00Z
NVDA.O,EarningsReleases,Q4 2009 NVIDIA Corporation Earnings Release,02/10/2009,2009-02-10T21:00:00Z
NVDA.O,EarningsCallsAndPresentations,Q4 2009 NVIDIA Corporation Earnings Conference Call,02/10/2009,2009-02-10T22:00:00Z
NVDA.O,ConferencePresentations,NVIDIA Corporation at WJB Capital Group Silicon Valley Bus Tour,02/24/2009,2009-02-24T20:00:00Z
NVDA.O,ConferencePresentations,NVIDIA Corporation at Goldman Sachs Technology and Internet Conference,02/26/2009,2009-02-26T17:40:00Z
NVDA.O,ConferencePresentations,NVIDIA Corporation at Morgan Stanley Technology Conference,03/03/2009,2009-03-03T22:55:00Z
NVDA.O,ConferencePresentations,NVIDIA Corporation at Raymond James Institutional Investors Conference,03/11/2009,2009-03-11T17:05:00Z
NVDA.O,EarningsReleases,Q1 2010 NVIDIA Corporation Earnings Release,05/07/2009,2009-05-07T20:00:00Z
NVDA.O,EarningsCallsAndPresentations,Q1 2010 NVIDIA Corporation Earnings Conference Call,05/07/2009,2009-05-07T21:00:00Z
NVDA.O,ConferencePresentations,NVIDIA Corporation at CanaccordAdams Technology Ideas Conference,05/14/2009,2009-05-14T13:00:00Z
NVDA.O,ConferencePresentations,"NVIDIA Corporation at JPMorgan Global Technology, Media and Telecom Conference",05/18/2009,2009-05-18T15:20:00Z
NVDA.O,ConferencePresentations,NVIDIA Corporation at Thomson Reuters Global Technology Summit - New York,05/18/2009,2009-05-18T18:00:00Z
NVDA.O,ShareholderAndAnnualMeetings,NVIDIA Corporation Annual Meeting of Stockholders,05/20/2009,2009-05-20T16:00:00Z
NVDA.O,CorporateAnalystMeetings,NVIDIA Corporation Analyst Day,06/16/2009,2009-06-16T17:00:00Z
NVDA.O,EarningsReleases,Q2 2010 NVIDIA Corporation Earnings Release,08/06/2009,2009-08-06T20:00:00Z
NVDA.O,EarningsCallsAndPresentations,Q2 2010 NVIDIA Corporation Earnings Conference Call,08/06/2009,2009-08-06T21:00:00Z
NVDA.O,ConferencePresentations,NVIDIA Corporation at Pacific Crest Securities Technology Leadership Forum,08/11/2009,2009-08-11T18:30:00Z
NVDA.O,ConferencePresentations,NVIDIA Corporation at Kaufman Brothers Investor Conference,09/09/2009,2009-09-09T19:00:00Z
NVDA.O,ConferencePresentations,NVIDIA Corporation at Citi Annual Global Technology Conference,09/10/2009,2009-09-10T18:50:00Z
NVDA.O,ConferencePresentations,NVIDIA Corporation at Deutsche Bank Securities Technology Conference,09/16/2009,2009-09-16T18:30:00Z
NVDA.O,ConferencePresentations,NVIDIA Corporation at Think Equity Growth Conference,09/17/2009,2009-09-17T17:30:00Z
NVDA.O,CorporateCallsAndPresentations,NVIDIA Corporation Discusses GPU Technology Conference,10/01/2009,2009-10-01T14:30:00Z
NVDA.O,EarningsReleases,Q3 2010 NVIDIA Corporation Earnings Release,11/05/2009,2009-11-05T21:00:00Z
NVDA.O,EarningsCallsAndPresentations,Q3 2010 NVIDIA Corporation Earnings Conference Call,11/05/2009,2009-11-05T22:00:00Z
NVDA.O,ConferencePresentations,NVIDIA Corporation at Friedman Billings Ramsey Capital Markets Technology Conference,12/01/2009,2009-12-01T13:30:00Z
NVDA.O,ConferencePresentations,NVIDIA Corporation at Credit Suisse Group Technology Conference,12/02/2009,2009-12-02T21:30:00Z
NVDA.O,ConferencePresentations,NVIDIA Corporation at Barclays Technology Conference,12/08/2009,2009-12-08T21:30:00Z
NVDA.O,ConferencePresentations,NVIDIA Corporation at CEA International Consumer Electronics Show,01/07/2010,2010-01-07T18:30:00Z
NVDA.O,ConferencePresentations,NVIDIA Corporation at JPMorgan Technology Forum,01/07/2010,2010-01-07T19:30:00Z
NVDA.O,EarningsReleases,Q4 2010 NVIDIA Corporation Earnings Release,02/17/2010,2010-02-17T21:20:00Z
NVDA.O,EarningsCallsAndPresentations,Q4 2010 NVIDIA Corporation Earnings Conference Call,02/17/2010,2010-02-17T22:00:00Z
NVDA.O,ConferencePresentations,NVIDIA Corporation at Goldman Sachs Technology Conference,02/25/2010,2010-02-25T00:40:00Z
NVDA.O,ConferencePresentations,"NVIDIA Corporation at Morgan Stanley Technology, Media & Telecom Conference",03/03/2010,2010-03-03T21:35:00Z
NVDA.O,ConferencePresentations,NVIDIA Corporation at Raymond James Institutional Investors Conference,03/08/2010,2010-03-08T21:35:00Z
NVDA.O,ConferencePresentations,NVIDIA Corporation at Wedbush Morgan Securities New York MAC: Management Access Conference,03/10/2010,2010-03-10T19:00:00Z
NVDA.O,ConferencePresentations,NVIDIA Corporation at ROTH OC Growth Stock Conference,03/16/2010,2010-03-16T16:30:00Z
NVDA.O,CorporateAnalystMeetings,NVIDIA Corporation Analyst Meeting,04/07/2010,2010-04-07T17:00:00Z
NVDA.O,EarningsReleases,Q1 2011 NVIDIA Corporation Earnings Release,05/13/2010,2010-05-13T20:20:00Z
NVDA.O,EarningsCallsAndPresentations,Q1 2011 NVIDIA Corporation Earnings Conference Call,05/13/2010,2010-05-13T21:00:00Z
NVDA.O,ShareholderAndAnnualMeetings,NVIDIA Corporation Shareholders Meeting,05/19/2010,2010-05-19T16:00:00Z
NVDA.O,ConferencePresentations,NVIDIA Corporation at UBS Global Technology and Services Conference,06/09/2010,2010-06-09T15:30:00Z
NVDA.O,EarningsReleases,Q2 2011 NVIDIA Corporation Earnings Release,08/12/2010,2010-08-12T20:20:00Z
NVDA.O,EarningsCallsAndPresentations,Q2 2011 NVIDIA Corporation Earnings Conference Call,08/12/2010,2010-08-12T21:00:00Z
NVDA.O,ConferencePresentations,NVIDIA Corporation at Citigroup Global Technology Conference,09/08/2010,2010-09-08T17:50:00Z
NVDA.O,ConferencePresentations,NVIDIA Corporation at Deutsche Bank Securities Inc. Technology Conference,09/14/2010,2010-09-14T20:45:00Z
NVDA.O,EarningsReleases,Q3 2011 NVIDIA Corporation Earnings Release,11/11/2010,2010-11-11T21:20:00Z
NVDA.O,EarningsCallsAndPresentations,Q3 2011 NVIDIA Corporation Earnings Conference Call,11/11/2010,2010-11-11T22:00:00Z
NVDA.O,ConferencePresentations,NVIDIA Corporation at Barclays Capital Global Technology Conference,12/09/2010,2010-12-09T22:00:00Z
NVDA.O,ConferencePresentations,"NVIDIA Corporation at Nomura Securities Co., Ltd:  Nomura@CES",01/05/2011,2011-01-05T20:00:00Z
NVDA.O,ConferencePresentations,NVIDIA Corporation at Consumer Electronics Association International CES,01/05/2011,2011-01-05T20:00:00Z
NVDA.O,ConferencePresentations,NVIDIA Corporation at JPMorgan Tech Forum@CES,01/06/2011,2011-01-06T18:35:00Z
NVDA.O,CorporateCallsAndPresentations,NVIDIA Corporation,01/10/2011,2011-01-10T22:00:00Z
NVDA.O,EarningsReleases,Q4 2011 NVIDIA Corporation Earnings Release,02/16/2011,2011-02-16T21:20:00Z
NVDA.O,EarningsCallsAndPresentations,Q4 2011 NVIDIA Corporation Earnings Conference Call,02/16/2011,2011-02-16T22:00:00Z
NVDA.O,ConferencePresentations,NVIDIA Corporation at Goldman Sachs Technology & Internet Conference,02/17/2011,2011-02-17T17:40:00Z
NVDA.O,ConferencePresentations,"NVIDIA Corporation at Morgan Stanley Technology, Media & Telecom Conference",02/28/2011,2011-02-28T16:45:00Z
NVDA.O,CorporateAnalystMeetings,NVIDIA Corporation Analyst Meeting,03/08/2011,2011-03-08T17:00:00Z
NVDA.O,ConferencePresentations,"NVIDIA Corporation at Wedbush Morgan Securities Technology, Media & Telecommunications: Management Access Conference",03/10/2011,2011-03-10T19:55:00Z
NVDA.O,ConferencePresentations,Nvidia Corp at Roth Capital Partners OC Growth Stock Conference,03/14/2011,2011-03-14T18:30:00Z
NVDA.O,EarningsReleases,Q1 2012 NVIDIA Corporation Earnings Release,05/12/2011,2011-05-12T20:00:00Z
NVDA.O,EarningsCallsAndPresentations,Q1 2012 Nvidia Corp Earnings Conference Call,05/12/2011,2011-05-12T21:00:00Z
NVDA.O,ConferencePresentations,Nvidia Corp at Thomson Reuters Global Technology Summit - New York,05/16/2011,2011-05-16T18:30:00Z
NVDA.O,ConferencePresentations,"Nvidia Corp at JPMorgan Technology, Media and Telecom Conference",05/17/2011,2011-05-17T15:20:00Z
NVDA.O,ShareholderAndAnnualMeetings,Nvidia Corp Shareholders Meeting,05/18/2011,2011-05-18T16:00:00Z
NVDA.O,ConferencePresentations,Nvidia Corp at Bank of America Merrill Lynch Technology Conference,06/01/2011,2011-06-01T19:20:00Z
NVDA.O,ConferencePresentations,Nvidia Corp at Cowen and Company Technology Media & Telecom Conference,06/02/2011,2011-06-02T14:15:00Z
NVDA.O,EarningsReleases,Q2 2012 Nvidia Corp Earnings Release,08/11/2011,2011-08-11T20:00:00Z
NVDA.O,EarningsCallsAndPresentations,Q2 2012 Nvidia Corp Earnings Conference Call,08/11/2011,2011-08-11T21:00:00Z
NVDA.O,ConferencePresentations,Nvidia Corp at Citi Global Technology Conference,09/06/2011,2011-09-06T20:05:00Z
NVDA.O,ConferencePresentations,"Nvidia Corp at Kaufman Brothers, L.P. Investor Conference",09/08/2011,2011-09-08T13:30:00Z
NVDA.O,ConferencePresentations,Nvidia Corp to Host Automotive Industry Briefing Luncheon and Technology Demonstration,10/18/2011,2011-10-18T16:00:00Z
NVDA.O,EarningsReleases,Q3 2012 Nvidia Corp Earnings Release,11/10/2011,2011-11-10T21:00:00Z
NVDA.O,EarningsCallsAndPresentations,Q3 2012 Nvidia Corp Earnings Conference Call,11/10/2011,2011-11-10T22:00:00Z
NVDA.O,ConferencePresentations,Nvidia Corp at UBS Global Technology and Services Conference,11/17/2011,2011-11-17T17:00:00Z
NVDA.O,ConferencePresentations,Nvidia Corp at Barclays Capital Global Technology Conference,12/07/2011,2011-12-07T22:30:00Z
NVDA.O,EarningsReleases,Q4 2012 Nvidia Corp Earnings Release,02/15/2012,2012-02-15T21:00:00Z
NVDA.O,EarningsCallsAndPresentations,Q4 2012 Nvidia Corp Earnings Conference Call,02/15/2012,2014-07-29T05:00:00Z
NVDA.O,ConferencePresentations,NVIDIA Corporation at Goldman Sachs Group Inc Technology and Internet Conference,02/16/2012,2012-02-16T17:00:00Z
NVDA.O,ConferencePresentations,"NVIDIA Corporation at Morgan Stanley Technology, Media & Telecom Conference",02/29/2012,2012-02-29T00:05:00Z
NVDA.O,ConferencePresentations,NVIDIA Corporation at Raymond James Institutional Investors Conference,03/05/2012,2012-03-05T19:50:00Z
NVDA.O,ConferencePresentations,"NVIDIA Corporation at Wedbush Securities Inc Technology, Media & Telecommunications Conference",03/07/2012,2012-03-07T13:35:00Z
NVDA.O,ConferencePresentations,NVIDIA Corporation at Roth Capital OC Growth Stock Conference,03/12/2012,2012-03-12T18:30:00Z
NVDA.O,EarningsCallsAndPresentations,Q1 2013 NVIDIA Corporation Earnings Conference Call,05/11/2012,2012-05-11T12:00:00Z
NVDA.O,EarningsReleases,Q1 2013 NVIDIA Corporation Earnings Release,05/11/2012,2012-05-11T12:30:00Z
NVDA.O,ShareholderAndAnnualMeetings,NVIDIA Corporation Annual Shareholder Meeting,05/17/2012,2012-05-17T21:00:00Z
NVDA.O,CorporateAnalystMeetings,NVIDIA Corporation 2012 Investor Meeting,05/24/2012,2012-05-24T16:00:00Z
NVDA.O,EarningsReleases,Q2 2013 NVIDIA Corporation Earnings Release,08/09/2012,2012-08-09T20:00:00Z
NVDA.O,EarningsCallsAndPresentations,Q2 2013 NVIDIA Corporation Earnings Conference Call,08/09/2012,2012-08-09T21:00:00Z
NVDA.O,ConferencePresentations,"NVIDIA Corporation at Oppenheimer Holdings Inc Technology, Internet & Communications Conference",08/14/2012,2012-08-14T13:45:00Z
NVDA.O,ConferencePresentations,NVIDIA Corporation at Pacific Crest Global Leadership Technology Forum,08/14/2012,2012-08-14T16:30:00Z
NVDA.O,ConferencePresentations,NVIDIA Corporation at Roth Capital Partners Semiconductor Corporate Access Day,09/05/2012,2012-09-05T19:00:00Z
NVDA.O,ConferencePresentations,NVIDIA Corporation at Citi Technology Conference,09/06/2012,2012-09-06T13:30:00Z
NVDA.O,ConferencePresentations,NVIDIA Corporation at Think Equity Growth Conference,09/13/2012,2012-09-13T13:00:00Z
NVDA.O,EarningsReleases,Q3 2013 NVIDIA Corporation Earnings Release,11/08/2012,2012-11-08T21:00:00Z
NVDA.O,EarningsCallsAndPresentations,Q3 2013 NVIDIA Corporation Earnings Conference Call,11/08/2012,2012-11-08T22:00:00Z
NVDA.O,ConferencePresentations,NVIDIA Corporation at UBS Global Technology and Services Conference,11/15/2012,2012-11-15T14:00:00Z
NVDA.O,ExDividends,"NVDAEUR.SGp^L17 Final Cash Dividend of gross USD 0.075 paid on Dec 14, 2012 going ex on Nov 20, 2012",11/20/2012,2021-07-20T00:00:00Z
NVDA.O,ExDividends,"NVDA.DEU Final Cash Dividend of gross USD 0.075 paid on Dec 14, 2012 going ex on Nov 20, 2012",11/20/2012,2021-07-20T00:00:00Z
NVDA.O,ExDividends,"NVDA.TG Final Cash Dividend of gross USD 0.075 paid on Dec 14, 2012 going ex on Nov 20, 2012",11/20/2012,2021-07-20T00:00:00Z
NVDA.O,ExDividends,"NVDA.DY Final Cash Dividend of gross USD 0.075 paid on Dec 14, 2012 going ex on Nov 20, 2012",11/20/2012,2021-07-20T00:00:00Z
NVDA.O,ExDividends,"NVDA.DG Final Cash Dividend of gross USD 0.075 paid on Dec 14, 2012 going ex on Nov 20, 2012",11/20/2012,2021-07-20T00:00:00Z
NVDA.O,ExDividends,"NVDA.A Final Cash Dividend of gross USD 0.075 paid on Dec 14, 2012 going ex on Nov 20, 2012",11/20/2012,2021-07-20T00:00:00Z
NVDA.O,ExDividends,"NVDA.PH Final Cash Dividend of gross USD 0.075 paid on Dec 14, 2012 going ex on Nov 20, 2012",11/20/2012,2021-07-20T00:00:00Z
NVDA.O,ExDividends,"NVDA.ZY Final Cash Dividend of gross USD 0.075 paid on Dec 14, 2012 going ex on Nov 20, 2012",11/20/2012,2021-07-20T00:00:00Z
NVDA.O,ExDividends,"NVDA.MX Final Cash Dividend of gross USD 0.075 paid on Dec 14, 2012 going ex on Nov 20, 2012",11/20/2012,2021-07-20T00:00:00Z
NVDA.O,ExDividends,"NVDA.DF Final Cash Dividend of gross USD 0.075 paid on Dec 14, 2012 going ex on Nov 20, 2012",11/20/2012,2021-07-20T00:00:00Z
NVDA.O,ExDividends,"NVDA.OQ Final Cash Dividend of gross USD 0.075 paid on Dec 14, 2012 going ex on Nov 20, 2012",11/20/2012,2021-07-20T00:00:00Z
NVDA.O,ExDividends,"NVDA.D Final Cash Dividend of gross USD 0.075 paid on Dec 14, 2012 going ex on Nov 20, 2012",11/20/2012,2021-07-20T00:00:00Z
NVDA.O,ExDividends,"NVDA.BE Final Cash Dividend of gross USD 0.075 paid on Dec 14, 2012 going ex on Nov 20, 2012",11/20/2012,2021-07-20T00:00:00Z
NVDA.O,ExDividends,"NVDA.F Final Cash Dividend of gross USD 0.075 paid on Dec 14, 2012 going ex on Nov 20, 2012",11/20/2012,2021-07-20T00:00:00Z
NVDA.O,ExDividends,"NVDA.W^E14 Final Cash Dividend of gross USD 0.075 paid on Dec 14, 2012 going ex on Nov 20, 2012",11/20/2012,2021-07-20T00:00:00Z
NVDA.O,ExDividends,"NVDA.P Final Cash Dividend of gross USD 0.075 paid on Dec 14, 2012 going ex on Nov 20, 2012",11/20/2012,2021-07-20T00:00:00Z
NVDA.O,ExDividends,"NVDA.MU Final Cash Dividend of gross USD 0.075 paid on Dec 14, 2012 going ex on Nov 20, 2012",11/20/2012,2021-07-20T00:00:00Z
NVDA.O,ExDividends,"NVDA.C Final Cash Dividend of gross USD 0.075 paid on Dec 14, 2012 going ex on Nov 20, 2012",11/20/2012,2021-07-20T00:00:00Z
NVDA.O,ExDividends,"NVDA.MW Final Cash Dividend of gross USD 0.075 paid on Dec 14, 2012 going ex on Nov 20, 2012",11/20/2012,2021-07-20T00:00:00Z
NVDA.O,ExDividends,"NVDA.SG Final Cash Dividend of gross USD 0.075 paid on Dec 14, 2012 going ex on Nov 20, 2012",11/20/2012,2021-07-20T00:00:00Z
NVDA.O,ExDividends,"NVDA.H Final Cash Dividend of gross USD 0.075 paid on Dec 14, 2012 going ex on Nov 20, 2012",11/20/2012,2021-07-20T00:00:00Z
NVDA.O,ExDividends,"NVDA.O Final Cash Dividend of gross USD 0.075 paid on Dec 14, 2012 going ex on Nov 20, 2012",11/20/2012,2021-07-20T00:00:00Z
NVDA.O,ExDividends,"NVDAEUR.DEp^A18 Final Cash Dividend of gross USD 0.075 paid on Dec 14, 2012 going ex on Nov 20, 2012",11/20/2012,2021-07-20T00:00:00Z
NVDA.O,ExDividends,"NVDA.Z Final Cash Dividend of gross USD 0.075 paid on Dec 14, 2012 going ex on Nov 20, 2012",11/20/2012,2021-07-20T00:00:00Z
NVDA.O,ExDividends,"NVDA.B Final Cash Dividend of gross USD 0.075 paid on Dec 14, 2012 going ex on Nov 20, 2012",11/20/2012,2021-07-20T00:00:00Z
NVDA.O,ConferencePresentations,NVIDIA Corporation at Raymond James IT Supply Chain Conference,12/11/2012,2012-12-11T18:50:00Z
NVDA.O,ConferencePresentations,NVIDIA Corporation at Consumer Electronics Association International CES Conference,01/07/2013,2013-01-07T04:00:00Z
NVDA.O,ConferencePresentations,NVIDIA Corporation at JPMorgan Tech Forum at CES Conference,01/08/2013,2013-01-08T16:25:00Z
NVDA.O,EarningsReleases,Q4 2013 NVIDIA Corporation Earnings Release,02/13/2013,2013-02-13T21:00:00Z
NVDA.O,EarningsCallsAndPresentations,Q4 2013 NVIDIA Corporation Earnings Conference Call,02/13/2013,2013-02-13T22:00:00Z
NVDA.O,ConferencePresentations,NVIDIA Corporation at Goldman Sachs Technology & Internet Conference,02/14/2013,2013-02-14T17:40:00Z
NVDA.O,ConferencePresentations,"NVIDIA Corporation at Morgan Stanley Technology, Media & Telecom Conference",02/26/2013,2013-02-26T00:35:00Z
NVDA.O,ExDividends,"NVDAEUR.SGp^L17 Interim Cash Dividend of gross USD 0.075 paid on Mar 21, 2013 going ex on Feb 26, 2013",02/26/2013,2021-07-20T00:00:00Z
NVDA.O,ExDividends,"NVDA.DEU Interim Cash Dividend of gross USD 0.075 paid on Mar 21, 2013 going ex on Feb 26, 2013",02/26/2013,2021-07-20T00:00:00Z
NVDA.O,ExDividends,"NVDA.TG Interim Cash Dividend of gross USD 0.075 paid on Mar 21, 2013 going ex on Feb 26, 2013",02/26/2013,2021-07-20T00:00:00Z
NVDA.O,ExDividends,"NVDA.DY Interim Cash Dividend of gross USD 0.075 paid on Mar 21, 2013 going ex on Feb 26, 2013",02/26/2013,2021-07-20T00:00:00Z
NVDA.O,ExDividends,"NVDA.DG Interim Cash Dividend of gross USD 0.075 paid on Mar 21, 2013 going ex on Feb 26, 2013",02/26/2013,2021-07-20T00:00:00Z
NVDA.O,ExDividends,"NVDA.A Interim Cash Dividend of gross USD 0.075 paid on Mar 21, 2013 going ex on Feb 26, 2013",02/26/2013,2021-07-20T00:00:00Z
NVDA.O,ExDividends,"NVDA.PH Interim Cash Dividend of gross USD 0.075 paid on Mar 21, 2013 going ex on Feb 26, 2013",02/26/2013,2021-07-20T00:00:00Z
NVDA.O,ExDividends,"NVDA.ZY Interim Cash Dividend of gross USD 0.075 paid on Mar 21, 2013 going ex on Feb 26, 2013",02/26/2013,2021-07-20T00:00:00Z
NVDA.O,ExDividends,"NVDA.MX Interim Cash Dividend of gross USD 0.075 paid on Mar 21, 2013 going ex on Feb 26, 2013",02/26/2013,2021-07-20T00:00:00Z
NVDA.O,ExDividends,"NVDA.DF Interim Cash Dividend of gross USD 0.075 paid on Mar 21, 2013 going ex on Feb 26, 2013",02/26/2013,2021-07-20T00:00:00Z
NVDA.O,ExDividends,"NVDA.OQ Interim Cash Dividend of gross USD 0.075 paid on Mar 21, 2013 going ex on Feb 26, 2013",02/26/2013,2021-07-20T00:00:00Z
NVDA.O,ExDividends,"NVDA.D Interim Cash Dividend of gross USD 0.075 paid on Mar 21, 2013 going ex on Feb 26, 2013",02/26/2013,2021-07-20T00:00:00Z
NVDA.O,ExDividends,"NVDA.BE Interim Cash Dividend of gross USD 0.075 paid on Mar 21, 2013 going ex on Feb 26, 2013",02/26/2013,2021-07-20T00:00:00Z
NVDA.O,ExDividends,"NVDA.F Interim Cash Dividend of gross USD 0.075 paid on Mar 21, 2013 going ex on Feb 26, 2013",02/26/2013,2021-07-20T00:00:00Z
NVDA.O,ExDividends,"NVDA.W^E14 Interim Cash Dividend of gross USD 0.075 paid on Mar 21, 2013 going ex on Feb 26, 2013",02/26/2013,2021-07-20T00:00:00Z
NVDA.O,ExDividends,"NVDA.P Interim Cash Dividend of gross USD 0.075 paid on Mar 21, 2013 going ex on Feb 26, 2013",02/26/2013,2021-07-20T00:00:00Z
NVDA.O,ExDividends,"NVDA.MU Interim Cash Dividend of gross USD 0.075 paid on Mar 21, 2013 going ex on Feb 26, 2013",02/26/2013,2021-07-20T00:00:00Z
NVDA.O,ExDividends,"NVDA.C Interim Cash Dividend of gross USD 0.075 paid on Mar 21, 2013 going ex on Feb 26, 2013",02/26/2013,2021-07-20T00:00:00Z
NVDA.O,ExDividends,"NVDA.MW Interim Cash Dividend of gross USD 0.075 paid on Mar 21, 2013 going ex on Feb 26, 2013",02/26/2013,2021-07-20T00:00:00Z
NVDA.O,ExDividends,"NVDA.SG Interim Cash Dividend of gross USD 0.075 paid on Mar 21, 2013 going ex on Feb 26, 2013",02/26/2013,2021-07-20T00:00:00Z
NVDA.O,ExDividends,"NVDA.H Interim Cash Dividend of gross USD 0.075 paid on Mar 21, 2013 going ex on Feb 26, 2013",02/26/2013,2021-07-20T00:00:00Z
NVDA.O,ExDividends,"NVDA.O Interim Cash Dividend of gross USD 0.075 paid on Mar 21, 2013 going ex on Feb 26, 2013",02/26/2013,2021-07-20T00:00:00Z
NVDA.O,ExDividends,"NVDAEUR.DEp^A18 Interim Cash Dividend of gross USD 0.075 paid on Mar 21, 2013 going ex on Feb 26, 2013",02/26/2013,2021-07-20T00:00:00Z
NVDA.O,ExDividends,"NVDA.Z Interim Cash Dividend of gross USD 0.075 paid on Mar 21, 2013 going ex on Feb 26, 2013",02/26/2013,2021-07-20T00:00:00Z
NVDA.O,ExDividends,"NVDA.B Interim Cash Dividend of gross USD 0.075 paid on Mar 21, 2013 going ex on Feb 26, 2013",02/26/2013,2021-07-20T00:00:00Z
NVDA.O,ConferencePresentations,NVIDIA Corporation at Raymond James Institutional Investors Conference,03/04/2013,2013-03-04T19:50:00Z
NVDA.O,ConferencePresentations,NVIDIA Corporation at Susquehanna Semiconductor Summit,03/05/2013,2013-03-05T17:00:00Z
NVDA.O,ConferencePresentations,"NVIDIA Corporation at Wedbush Technology, Media, Telecommunication Management Access Conference",03/07/2013,2013-03-07T13:35:00Z
NVDA.O,CorporateAnalystMeetings,Investor Session on NVIDIA’s Business with CEO Jen-Hsun Huang,03/19/2013,2013-03-19T18:30:00Z
NVDA.O,CorporateAnalystMeetings,NVIDIA Corporation Annual Investor Day,04/11/2013,2013-04-11T16:00:00Z
NVDA.O,EarningsReleases,Q1 2014 NVIDIA Corporation Earnings Release,05/09/2013,2013-05-09T20:00:00Z
NVDA.O,EarningsCallsAndPresentations,Q1 2014 NVIDIA Corporation Earnings Conference Call,05/09/2013,2013-05-09T21:00:00Z
NVDA.O,ShareholderAndAnnualMeetings,Annual Meeting of Stockholders,05/15/2013,2013-05-15T16:00:00Z
NVDA.O,ExDividends,"NVDAEUR.SGp^L17 Interim Cash Dividend of gross USD 0.075 paid on Jun 14, 2013 going ex on May 21, 2013",05/21/2013,2021-07-20T00:00:00Z
NVDA.O,ExDividends,"NVDA.DEU Interim Cash Dividend of gross USD 0.075 paid on Jun 14, 2013 going ex on May 21, 2013",05/21/2013,2021-07-20T00:00:00Z
NVDA.O,ExDividends,"NVDA.TG Interim Cash Dividend of gross USD 0.075 paid on Jun 14, 2013 going ex on May 21, 2013",05/21/2013,2021-07-20T00:00:00Z
NVDA.O,ExDividends,"NVDA.DY Interim Cash Dividend of gross USD 0.075 paid on Jun 14, 2013 going ex on May 21, 2013",05/21/2013,2021-07-20T00:00:00Z
NVDA.O,ExDividends,"NVDA.DG Interim Cash Dividend of gross USD 0.075 paid on Jun 14, 2013 going ex on May 21, 2013",05/21/2013,2021-07-20T00:00:00Z
NVDA.O,ExDividends,"NVDA.A Interim Cash Dividend of gross USD 0.075 paid on Jun 14, 2013 going ex on May 21, 2013",05/21/2013,2021-07-20T00:00:00Z
NVDA.O,ExDividends,"NVDA.PH Interim Cash Dividend of gross USD 0.075 paid on Jun 14, 2013 going ex on May 21, 2013",05/21/2013,2021-07-20T00:00:00Z
NVDA.O,ExDividends,"NVDA.ZY Interim Cash Dividend of gross USD 0.075 paid on Jun 14, 2013 going ex on May 21, 2013",05/21/2013,2021-07-20T00:00:00Z
NVDA.O,ExDividends,"NVDA.DF Interim Cash Dividend of gross USD 0.075 paid on Jun 14, 2013 going ex on May 21, 2013",05/21/2013,2021-07-20T00:00:00Z
NVDA.O,ExDividends,"NVDA.OQ Interim Cash Dividend of gross USD 0.075 paid on Jun 14, 2013 going ex on May 21, 2013",05/21/2013,2021-07-20T00:00:00Z
NVDA.O,ExDividends,"NVDA.D Interim Cash Dividend of gross USD 0.075 paid on Jun 14, 2013 going ex on May 21, 2013",05/21/2013,2021-07-20T00:00:00Z
NVDA.O,ExDividends,"NVDA.BE Interim Cash Dividend of gross USD 0.075 paid on Jun 14, 2013 going ex on May 21, 2013",05/21/2013,2021-07-20T00:00:00Z
NVDA.O,ExDividends,"NVDA.F Interim Cash Dividend of gross USD 0.075 paid on Jun 14, 2013 going ex on May 21, 2013",05/21/2013,2021-07-20T00:00:00Z
NVDA.O,ExDividends,"NVDA.W^E14 Interim Cash Dividend of gross USD 0.075 paid on Jun 14, 2013 going ex on May 21, 2013",05/21/2013,2021-07-20T00:00:00Z
NVDA.O,ExDividends,"NVDA.P Interim Cash Dividend of gross USD 0.075 paid on Jun 14, 2013 going ex on May 21, 2013",05/21/2013,2021-07-20T00:00:00Z
NVDA.O,ExDividends,"NVDA.MU Interim Cash Dividend of gross USD 0.075 paid on Jun 14, 2013 going ex on May 21, 2013",05/21/2013,2021-07-20T00:00:00Z
NVDA.O,ExDividends,"NVDA.C Interim Cash Dividend of gross USD 0.075 paid on Jun 14, 2013 going ex on May 21, 2013",05/21/2013,2021-07-20T00:00:00Z
NVDA.O,ExDividends,"NVDA.MW Interim Cash Dividend of gross USD 0.075 paid on Jun 14, 2013 going ex on May 21, 2013",05/21/2013,2021-07-20T00:00:00Z
NVDA.O,ExDividends,"NVDA.SG Interim Cash Dividend of gross USD 0.075 paid on Jun 14, 2013 going ex on May 21, 2013",05/21/2013,2021-07-20T00:00:00Z
NVDA.O,ExDividends,"NVDA.H Interim Cash Dividend of gross USD 0.075 paid on Jun 14, 2013 going ex on May 21, 2013",05/21/2013,2021-07-20T00:00:00Z
NVDA.O,ExDividends,"NVDA.O Interim Cash Dividend of gross USD 0.075 paid on Jun 14, 2013 going ex on May 21, 2013",05/21/2013,2021-07-20T00:00:00Z
NVDA.O,ExDividends,"NVDAEUR.DEp^A18 Interim Cash Dividend of gross USD 0.075 paid on Jun 14, 2013 going ex on May 21, 2013",05/21/2013,2021-07-20T00:00:00Z
NVDA.O,ExDividends,"NVDA.Z Interim Cash Dividend of gross USD 0.075 paid on Jun 14, 2013 going ex on May 21, 2013",05/21/2013,2021-07-20T00:00:00Z
NVDA.O,ExDividends,"NVDA.B Interim Cash Dividend of gross USD 0.075 paid on Jun 14, 2013 going ex on May 21, 2013",05/21/2013,2021-07-20T00:00:00Z
NVDA.O,ConferencePresentations,"NVIDIA Corporation at Barclays Global Technology, Media and Telecommunications Conference",05/22/2013,2013-05-22T18:55:00Z
NVDA.O,ConferencePresentations,NVIDIA Corporation at Bank of America Merrill Lynch Global Technology Conference,06/04/2013,2013-06-04T23:00:00Z
NVDA.O,EarningsReleases,Q2 2014 NVIDIA Corporation Earnings Release,08/08/2013,2013-08-08T20:00:00Z
NVDA.O,EarningsCallsAndPresentations,Q2 2014 NVIDIA Corporation Earnings Conference Call,08/08/2013,2013-08-08T21:00:00Z
NVDA.O,ConferencePresentations,NVIDIA Corporation at Pacific Crest Global Technology Leadership Forum,08/12/2013,2013-08-12T20:00:00Z
NVDA.O,ConferencePresentations,"NVIDIA Corporation at Oppenheimer Technology, Internet & Communications Conference",08/14/2013,2013-08-14T13:05:00Z
NVDA.O,ConferencePresentations,NVIDIA Corporation at Canaccord Genuity Growth Conference,08/15/2013,2013-08-15T13:00:00Z
NVDA.O,ExDividends,"NVDAEUR.SGp^L17 Interim Cash Dividend of gross USD 0.075 paid on Sep 13, 2013 going ex on Aug 20, 2013",08/20/2013,2021-07-20T00:00:00Z
NVDA.O,ExDividends,"NVDA.DEU Interim Cash Dividend of gross USD 0.075 paid on Sep 13, 2013 going ex on Aug 20, 2013",08/20/2013,2021-07-20T00:00:00Z
NVDA.O,ExDividends,"NVDA.TG Interim Cash Dividend of gross USD 0.075 paid on Sep 13, 2013 going ex on Aug 20, 2013",08/20/2013,2021-07-20T00:00:00Z
NVDA.O,ExDividends,"NVDA.DY Interim Cash Dividend of gross USD 0.075 paid on Sep 13, 2013 going ex on Aug 20, 2013",08/20/2013,2021-07-20T00:00:00Z
NVDA.O,ExDividends,"NVDA.DG Interim Cash Dividend of gross USD 0.075 paid on Sep 13, 2013 going ex on Aug 20, 2013",08/20/2013,2021-07-20T00:00:00Z
NVDA.O,ExDividends,"NVDA.A Interim Cash Dividend of gross USD 0.075 paid on Sep 13, 2013 going ex on Aug 20, 2013",08/20/2013,2021-07-20T00:00:00Z
NVDA.O,ExDividends,"NVDA.PH Interim Cash Dividend of gross USD 0.075 paid on Sep 13, 2013 going ex on Aug 20, 2013",08/20/2013,2021-07-20T00:00:00Z
NVDA.O,ExDividends,"NVDA.ZY Interim Cash Dividend of gross USD 0.075 paid on Sep 13, 2013 going ex on Aug 20, 2013",08/20/2013,2021-07-20T00:00:00Z
NVDA.O,ExDividends,"NVDA.MX Interim Cash Dividend of gross USD 0.075 paid on Sep 13, 2013 going ex on Aug 20, 2013",08/20/2013,2021-07-20T00:00:00Z
NVDA.O,ExDividends,"NVDA.DF Interim Cash Dividend of gross USD 0.075 paid on Sep 13, 2013 going ex on Aug 20, 2013",08/20/2013,2021-07-20T00:00:00Z
NVDA.O,ExDividends,"NVDA.OQ Interim Cash Dividend of gross USD 0.075 paid on Sep 13, 2013 going ex on Aug 20, 2013",08/20/2013,2021-07-20T00:00:00Z
NVDA.O,ExDividends,"NVDA.D Interim Cash Dividend of gross USD 0.075 paid on Sep 13, 2013 going ex on Aug 20, 2013",08/20/2013,2021-07-20T00:00:00Z
NVDA.O,ExDividends,"NVDA.BE Interim Cash Dividend of gross USD 0.075 paid on Sep 13, 2013 going ex on Aug 20, 2013",08/20/2013,2021-07-20T00:00:00Z
NVDA.O,ExDividends,"NVDA.F Interim Cash Dividend of gross USD 0.075 paid on Sep 13, 2013 going ex on Aug 20, 2013",08/20/2013,2021-07-20T00:00:00Z
NVDA.O,ExDividends,"NVDA.W^E14 Interim Cash Dividend of gross USD 0.075 paid on Sep 13, 2013 going ex on Aug 20, 2013",08/20/2013,2021-07-20T00:00:00Z
NVDA.O,ExDividends,"NVDA.P Interim Cash Dividend of gross USD 0.075 paid on Sep 13, 2013 going ex on Aug 20, 2013",08/20/2013,2021-07-20T00:00:00Z
NVDA.O,ExDividends,"NVDA.MU Interim Cash Dividend of gross USD 0.075 paid on Sep 13, 2013 going ex on Aug 20, 2013",08/20/2013,2021-07-20T00:00:00Z
NVDA.O,ExDividends,"NVDA.C Interim Cash Dividend of gross USD 0.075 paid on Sep 13, 2013 going ex on Aug 20, 2013",08/20/2013,2021-07-20T00:00:00Z
NVDA.O,ExDividends,"NVDA.MW Interim Cash Dividend of gross USD 0.075 paid on Sep 13, 2013 going ex on Aug 20, 2013",08/20/2013,2021-07-20T00:00:00Z
NVDA.O,ExDividends,"NVDA.SG Interim Cash Dividend of gross USD 0.075 paid on Sep 13, 2013 going ex on Aug 20, 2013",08/20/2013,2021-07-20T00:00:00Z
NVDA.O,ExDividends,"NVDA.H Interim Cash Dividend of gross USD 0.075 paid on Sep 13, 2013 going ex on Aug 20, 2013",08/20/2013,2021-07-20T00:00:00Z
NVDA.O,ExDividends,"NVDA.O Interim Cash Dividend of gross USD 0.075 paid on Sep 13, 2013 going ex on Aug 20, 2013",08/20/2013,2021-07-20T00:00:00Z
NVDA.O,ExDividends,"NVDAEUR.DEp^A18 Interim Cash Dividend of gross USD 0.075 paid on Sep 13, 2013 going ex on Aug 20, 2013",08/20/2013,2021-07-20T00:00:00Z
NVDA.O,ExDividends,"NVDA.Z Interim Cash Dividend of gross USD 0.075 paid on Sep 13, 2013 going ex on Aug 20, 2013",08/20/2013,2021-07-20T00:00:00Z
NVDA.O,ExDividends,"NVDA.B Interim Cash Dividend of gross USD 0.075 paid on Sep 13, 2013 going ex on Aug 20, 2013",08/20/2013,2021-07-20T00:00:00Z
NVDA.O,ConferencePresentations,NVIDIA Corporation at B. Riley Silicon Valley Tech Tour,08/26/2013,2013-08-26T19:00:00Z
NVDA.O,ConferencePresentations,NVIDIA Corporation at Roth Capital Partners LLC SEMICONDUCTOR CORPORATE ACCESS DAY,09/09/2013,2013-09-09T19:00:00Z
NVDA.O,ConferencePresentations,NVIDIA Corporation at Deutsche Bank dbAccess Technology Conference,09/11/2013,2013-09-11T00:30:00Z
NVDA.O,EarningsReleases,Q3 2014 NVIDIA Corporation Earnings Release,11/07/2013,2013-11-07T21:00:00Z
NVDA.O,EarningsCallsAndPresentations,Q3 2014 NVIDIA Corporation Earnings Conference Call,11/07/2013,2013-11-07T22:00:00Z
NVDA.O,ConferencePresentations,"NVIDIA Corporation at Wells Fargo Technology, Media & Telecom Conference",11/12/2013,2013-11-12T18:45:00Z
NVDA.O,ExDividends,"NVDAEUR.SGp^L17 Final Cash Dividend of gross USD 0.085 paid on Dec 13, 2013 going ex on Nov 19, 2013",11/19/2013,2021-07-20T00:00:00Z
NVDA.O,ExDividends,"NVDA.DEU Final Cash Dividend of gross USD 0.085 paid on Dec 13, 2013 going ex on Nov 19, 2013",11/19/2013,2021-07-20T00:00:00Z
NVDA.O,ExDividends,"NVDA.TG Final Cash Dividend of gross USD 0.085 paid on Dec 13, 2013 going ex on Nov 19, 2013",11/19/2013,2021-07-20T00:00:00Z
NVDA.O,ExDividends,"NVDA.DY Final Cash Dividend of gross USD 0.085 paid on Dec 13, 2013 going ex on Nov 19, 2013",11/19/2013,2021-07-20T00:00:00Z
NVDA.O,ExDividends,"NVDA.DG Final Cash Dividend of gross USD 0.085 paid on Dec 13, 2013 going ex on Nov 19, 2013",11/19/2013,2021-07-20T00:00:00Z
NVDA.O,ExDividends,"NVDA.A Final Cash Dividend of gross USD 0.085 paid on Dec 13, 2013 going ex on Nov 19, 2013",11/19/2013,2021-07-20T00:00:00Z
NVDA.O,ExDividends,"NVDA.PH Final Cash Dividend of gross USD 0.085 paid on Dec 13, 2013 going ex on Nov 19, 2013",11/19/2013,2021-07-20T00:00:00Z
NVDA.O,ExDividends,"NVDA.ZY Final Cash Dividend of gross USD 0.085 paid on Dec 13, 2013 going ex on Nov 19, 2013",11/19/2013,2021-07-20T00:00:00Z
NVDA.O,ExDividends,"NVDA.MX Final Cash Dividend of gross USD 0.085 paid on Dec 13, 2013 going ex on Nov 19, 2013",11/19/2013,2021-07-20T00:00:00Z
NVDA.O,ExDividends,"NVDA.DF Final Cash Dividend of gross USD 0.085 paid on Dec 13, 2013 going ex on Nov 19, 2013",11/19/2013,2021-07-20T00:00:00Z
NVDA.O,ExDividends,"NVDA.OQ Final Cash Dividend of gross USD 0.085 paid on Dec 13, 2013 going ex on Nov 19, 2013",11/19/2013,2021-07-20T00:00:00Z
NVDA.O,ExDividends,"NVDA.D Final Cash Dividend of gross USD 0.085 paid on Dec 13, 2013 going ex on Nov 19, 2013",11/19/2013,2021-07-20T00:00:00Z
NVDA.O,ExDividends,"NVDA.BE Final Cash Dividend of gross USD 0.085 paid on Dec 13, 2013 going ex on Nov 19, 2013",11/19/2013,2021-07-20T00:00:00Z
NVDA.O,ExDividends,"NVDA.F Final Cash Dividend of gross USD 0.085 paid on Dec 13, 2013 going ex on Nov 19, 2013",11/19/2013,2021-07-20T00:00:00Z
NVDA.O,ExDividends,"NVDA.W^E14 Final Cash Dividend of gross USD 0.085 paid on Dec 13, 2013 going ex on Nov 19, 2013",11/19/2013,2021-07-20T00:00:00Z
NVDA.O,ExDividends,"NVDA.P Final Cash Dividend of gross USD 0.085 paid on Dec 13, 2013 going ex on Nov 19, 2013",11/19/2013,2021-07-20T00:00:00Z
NVDA.O,ExDividends,"NVDA.MU Final Cash Dividend of gross USD 0.085 paid on Dec 13, 2013 going ex on Nov 19, 2013",11/19/2013,2021-07-20T00:00:00Z
NVDA.O,ExDividends,"NVDA.C Final Cash Dividend of gross USD 0.085 paid on Dec 13, 2013 going ex on Nov 19, 2013",11/19/2013,2021-07-20T00:00:00Z
NVDA.O,ExDividends,"NVDA.MW Final Cash Dividend of gross USD 0.085 paid on Dec 13, 2013 going ex on Nov 19, 2013",11/19/2013,2021-07-20T00:00:00Z
NVDA.O,ExDividends,"NVDA.SG Final Cash Dividend of gross USD 0.085 paid on Dec 13, 2013 going ex on Nov 19, 2013",11/19/2013,2021-07-20T00:00:00Z
NVDA.O,ExDividends,"NVDA.H Final Cash Dividend of gross USD 0.085 paid on Dec 13, 2013 going ex on Nov 19, 2013",11/19/2013,2021-07-20T00:00:00Z
NVDA.O,ExDividends,"NVDA.O Final Cash Dividend of gross USD 0.085 paid on Dec 13, 2013 going ex on Nov 19, 2013",11/19/2013,2021-07-20T00:00:00Z
NVDA.O,ExDividends,"NVDAEUR.DEp^A18 Final Cash Dividend of gross USD 0.085 paid on Dec 13, 2013 going ex on Nov 19, 2013",11/19/2013,2021-07-20T00:00:00Z
NVDA.O,ExDividends,"NVDA.Z Final Cash Dividend of gross USD 0.085 paid on Dec 13, 2013 going ex on Nov 19, 2013",11/19/2013,2021-07-20T00:00:00Z
NVDA.O,ExDividends,"NVDA.B Final Cash Dividend of gross USD 0.085 paid on Dec 13, 2013 going ex on Nov 19, 2013",11/19/2013,2021-07-20T00:00:00Z
NVDA.O,ConferencePresentations,NVIDIA Corporation at UBS Global Technology Conference,11/21/2013,2013-11-21T22:45:00Z
NVDA.O,ConferencePresentations,"NVIDIA Corporation at BMO Technology, Media & Entertainment Conference",12/10/2013,2013-12-10T20:45:00Z
NVDA.O,ConferencePresentations,NVIDIA Corporation at Nomura CES Forum,01/07/2014,2014-01-07T20:00:00Z
NVDA.O,ConferencePresentations,NVIDIA Corporation at JPMorgan Tech Forum at CES Conference,01/07/2014,2014-01-07T17:00:00Z
NVDA.O,EarningsReleases,Q4 2014 NVIDIA Corporation Earnings Release,02/12/2014,2014-02-12T21:00:00Z
NVDA.O,EarningsCallsAndPresentations,Q4 2014 NVIDIA Corporation Earnings Conference Call,02/12/2014,2014-02-12T22:00:00Z
NVDA.O,ConferencePresentations,NVIDIA Corporation at Goldman Sachs Technology and Internet Conference,02/13/2014,2014-02-13T18:20:00Z
NVDA.O,ConferencePresentations,NVIDIA Corporation at GSM Association Mobile World Congress,02/25/2014,2014-02-25T08:00:00Z
NVDA.O,ExDividends,"NVDAEUR.SGp^L17 Interim Cash Dividend of gross USD 0.085 paid on Mar 20, 2014 going ex on Feb 25, 2014",02/25/2014,2021-07-20T00:00:00Z
NVDA.O,ExDividends,"NVDA.DEU Interim Cash Dividend of gross USD 0.085 paid on Mar 20, 2014 going ex on Feb 25, 2014",02/25/2014,2021-07-20T00:00:00Z
NVDA.O,ExDividends,"NVDA.TG Interim Cash Dividend of gross USD 0.085 paid on Mar 20, 2014 going ex on Feb 25, 2014",02/25/2014,2021-07-20T00:00:00Z
NVDA.O,ExDividends,"NVDA.DY Interim Cash Dividend of gross USD 0.085 paid on Mar 20, 2014 going ex on Feb 25, 2014",02/25/2014,2021-07-20T00:00:00Z
NVDA.O,ExDividends,"NVDA.DG Interim Cash Dividend of gross USD 0.085 paid on Mar 20, 2014 going ex on Feb 25, 2014",02/25/2014,2021-07-20T00:00:00Z
NVDA.O,ExDividends,"NVDA.A Interim Cash Dividend of gross USD 0.085 paid on Mar 20, 2014 going ex on Feb 25, 2014",02/25/2014,2021-07-20T00:00:00Z
NVDA.O,ExDividends,"NVDA.PH Interim Cash Dividend of gross USD 0.085 paid on Mar 20, 2014 going ex on Feb 25, 2014",02/25/2014,2021-07-20T00:00:00Z
NVDA.O,ExDividends,"NVDA.ZY Interim Cash Dividend of gross USD 0.085 paid on Mar 20, 2014 going ex on Feb 25, 2014",02/25/2014,2021-07-20T00:00:00Z
NVDA.O,ExDividends,"NVDA.MX Interim Cash Dividend of gross USD 0.085 paid on Mar 20, 2014 going ex on Feb 25, 2014",02/25/2014,2021-07-20T00:00:00Z
NVDA.O,ExDividends,"NVDA.BN Interim Cash Dividend of gross USD 0.085 paid on Mar 20, 2014 going ex on Feb 25, 2014",02/25/2014,2021-07-20T00:00:00Z
NVDA.O,ExDividends,"NVDA.DF Interim Cash Dividend of gross USD 0.085 paid on Mar 20, 2014 going ex on Feb 25, 2014",02/25/2014,2021-07-20T00:00:00Z
NVDA.O,ExDividends,"NVDA.OQ Interim Cash Dividend of gross USD 0.085 paid on Mar 20, 2014 going ex on Feb 25, 2014",02/25/2014,2021-07-20T00:00:00Z
NVDA.O,ExDividends,"NVDA.D Interim Cash Dividend of gross USD 0.085 paid on Mar 20, 2014 going ex on Feb 25, 2014",02/25/2014,2021-07-20T00:00:00Z
NVDA.O,ExDividends,"NVDA.BE Interim Cash Dividend of gross USD 0.085 paid on Mar 20, 2014 going ex on Feb 25, 2014",02/25/2014,2021-07-20T00:00:00Z
NVDA.O,ExDividends,"NVDA.F Interim Cash Dividend of gross USD 0.085 paid on Mar 20, 2014 going ex on Feb 25, 2014",02/25/2014,2021-07-20T00:00:00Z
NVDA.O,ExDividends,"NVDA.W^E14 Interim Cash Dividend of gross USD 0.085 paid on Mar 20, 2014 going ex on Feb 25, 2014",02/25/2014,2021-07-20T00:00:00Z
NVDA.O,ExDividends,"NVDA.P Interim Cash Dividend of gross USD 0.085 paid on Mar 20, 2014 going ex on Feb 25, 2014",02/25/2014,2021-07-20T00:00:00Z
NVDA.O,ExDividends,"NVDA.MU Interim Cash Dividend of gross USD 0.085 paid on Mar 20, 2014 going ex on Feb 25, 2014",02/25/2014,2021-07-20T00:00:00Z
NVDA.O,ExDividends,"NVDA.C Interim Cash Dividend of gross USD 0.085 paid on Mar 20, 2014 going ex on Feb 25, 2014",02/25/2014,2021-07-20T00:00:00Z
NVDA.O,ExDividends,"NVDA.MW Interim Cash Dividend of gross USD 0.085 paid on Mar 20, 2014 going ex on Feb 25, 2014",02/25/2014,2021-07-20T00:00:00Z
NVDA.O,ExDividends,"NVDA.SG Interim Cash Dividend of gross USD 0.085 paid on Mar 20, 2014 going ex on Feb 25, 2014",02/25/2014,2021-07-20T00:00:00Z
NVDA.O,ExDividends,"NVDA.H Interim Cash Dividend of gross USD 0.085 paid on Mar 20, 2014 going ex on Feb 25, 2014",02/25/2014,2021-07-20T00:00:00Z
NVDA.O,ExDividends,"NVDA.O Interim Cash Dividend of gross USD 0.085 paid on Mar 20, 2014 going ex on Feb 25, 2014",02/25/2014,2021-07-20T00:00:00Z
NVDA.O,ExDividends,"NVDAEUR.DEp^A18 Interim Cash Dividend of gross USD 0.085 paid on Mar 20, 2014 going ex on Feb 25, 2014",02/25/2014,2021-07-20T00:00:00Z
NVDA.O,ExDividends,"NVDA.Z Interim Cash Dividend of gross USD 0.085 paid on Mar 20, 2014 going ex on Feb 25, 2014",02/25/2014,2021-07-20T00:00:00Z
NVDA.O,ExDividends,"NVDA.B Interim Cash Dividend of gross USD 0.085 paid on Mar 20, 2014 going ex on Feb 25, 2014",02/25/2014,2021-07-20T00:00:00Z
NVDA.O,ConferencePresentations,NVIDIA Corporation at Raymond James Financial Inc Institutional Investors Conference,03/03/2014,2014-03-03T21:00:00Z
NVDA.O,ConferencePresentations,"NVIDIA Corporation at Morgan Stanley Technology, Media & Telecom Conference",03/06/2014,2014-03-06T16:45:00Z
NVDA.O,CorporateAnalystMeetings,NVIDIA Corporation Investor Day,03/25/2014,2014-03-25T19:15:00Z
NVDA.O,Conferences,GTC's Emerging Companies Summit,03/26/2014,2014-03-26T19:00:00Z
NVDA.O,ConferencePresentations,NVIDIA Corporation at Wells Fargo Tech Transformation Summit,04/03/2014,2014-04-03T19:30:00Z
NVDA.O,EarningsReleases,Preliminary Q1 2015 NVIDIA Corporation Earnings Release,05/06/2014,2014-05-06T12:30:00Z
NVDA.O,EarningsReleases,Q1 2015 NVIDIA Corporation Earnings Release,05/08/2014,2014-05-08T20:00:00Z
NVDA.O,EarningsCallsAndPresentations,Q1 2015 NVIDIA Corporation Earnings Conference Call,05/08/2014,2014-05-08T21:00:00Z
NVDA.O,ConferencePresentations,NVIDIA Corporation at Wedbush Transformational Technologies Management Access Conference,05/13/2014,2014-05-13T13:10:00Z
NVDA.O,ExDividends,"NVDAEUR.SGp^L17 Interim Cash Dividend of gross USD 0.085 paid on Jun 13, 2014 going ex on May 20, 2014",05/20/2014,2021-07-20T00:00:00Z
NVDA.O,ExDividends,"NVDA.DEU Interim Cash Dividend of gross USD 0.085 paid on Jun 13, 2014 going ex on May 20, 2014",05/20/2014,2021-07-20T00:00:00Z
NVDA.O,ExDividends,"NVDA.TG Interim Cash Dividend of gross USD 0.085 paid on Jun 13, 2014 going ex on May 20, 2014",05/20/2014,2021-07-20T00:00:00Z
NVDA.O,ExDividends,"NVDA.DY Interim Cash Dividend of gross USD 0.085 paid on Jun 13, 2014 going ex on May 20, 2014",05/20/2014,2021-07-20T00:00:00Z
NVDA.O,ExDividends,"NVDA.DG Interim Cash Dividend of gross USD 0.085 paid on Jun 13, 2014 going ex on May 20, 2014",05/20/2014,2021-07-20T00:00:00Z
NVDA.O,ExDividends,"NVDA.A Interim Cash Dividend of gross USD 0.085 paid on Jun 13, 2014 going ex on May 20, 2014",05/20/2014,2021-07-20T00:00:00Z
NVDA.O,ExDividends,"NVDA.PH Interim Cash Dividend of gross USD 0.085 paid on Jun 13, 2014 going ex on May 20, 2014",05/20/2014,2021-07-20T00:00:00Z
NVDA.O,ExDividends,"NVDA.ZY Interim Cash Dividend of gross USD 0.085 paid on Jun 13, 2014 going ex on May 20, 2014",05/20/2014,2021-07-20T00:00:00Z
NVDA.O,ExDividends,"NVDA.MX Interim Cash Dividend of gross USD 0.085 paid on Jun 13, 2014 going ex on May 20, 2014",05/20/2014,2021-07-20T00:00:00Z
NVDA.O,ExDividends,"NVDA.NB Interim Cash Dividend of gross USD 0.085 paid on Jun 13, 2014 going ex on May 20, 2014",05/20/2014,2021-07-20T00:00:00Z
NVDA.O,ExDividends,"NVDA.BN Interim Cash Dividend of gross USD 0.085 paid on Jun 13, 2014 going ex on May 20, 2014",05/20/2014,2021-07-20T00:00:00Z
NVDA.O,ExDividends,"NVDA.DF Interim Cash Dividend of gross USD 0.085 paid on Jun 13, 2014 going ex on May 20, 2014",05/20/2014,2021-07-20T00:00:00Z
NVDA.O,ExDividends,"NVDA.OQ Interim Cash Dividend of gross USD 0.085 paid on Jun 13, 2014 going ex on May 20, 2014",05/20/2014,2021-07-20T00:00:00Z
NVDA.O,ExDividends,"NVDA.D Interim Cash Dividend of gross USD 0.085 paid on Jun 13, 2014 going ex on May 20, 2014",05/20/2014,2021-07-20T00:00:00Z
NVDA.O,ExDividends,"NVDA.BE Interim Cash Dividend of gross USD 0.085 paid on Jun 13, 2014 going ex on May 20, 2014",05/20/2014,2021-07-20T00:00:00Z
NVDA.O,ExDividends,"NVDA.F Interim Cash Dividend of gross USD 0.085 paid on Jun 13, 2014 going ex on May 20, 2014",05/20/2014,2021-07-20T00:00:00Z
NVDA.O,ExDividends,"NVDA.P Interim Cash Dividend of gross USD 0.085 paid on Jun 13, 2014 going ex on May 20, 2014",05/20/2014,2021-07-20T00:00:00Z
NVDA.O,ExDividends,"NVDA.MU Interim Cash Dividend of gross USD 0.085 paid on Jun 13, 2014 going ex on May 20, 2014",05/20/2014,2021-07-20T00:00:00Z
NVDA.O,ExDividends,"NVDA.C Interim Cash Dividend of gross USD 0.085 paid on Jun 13, 2014 going ex on May 20, 2014",05/20/2014,2021-07-20T00:00:00Z
NVDA.O,ExDividends,"NVDA.MW Interim Cash Dividend of gross USD 0.085 paid on Jun 13, 2014 going ex on May 20, 2014",05/20/2014,2021-07-20T00:00:00Z
NVDA.O,ExDividends,"NVDA.SG Interim Cash Dividend of gross USD 0.085 paid on Jun 13, 2014 going ex on May 20, 2014",05/20/2014,2021-07-20T00:00:00Z
NVDA.O,ExDividends,"NVDA.H Interim Cash Dividend of gross USD 0.085 paid on Jun 13, 2014 going ex on May 20, 2014",05/20/2014,2021-07-20T00:00:00Z
NVDA.O,ExDividends,"NVDA.O Interim Cash Dividend of gross USD 0.085 paid on Jun 13, 2014 going ex on May 20, 2014",05/20/2014,2021-07-20T00:00:00Z
NVDA.O,ExDividends,"NVDAEUR.DEp^A18 Interim Cash Dividend of gross USD 0.085 paid on Jun 13, 2014 going ex on May 20, 2014",05/20/2014,2021-07-20T00:00:00Z
NVDA.O,ExDividends,"NVDA.Z Interim Cash Dividend of gross USD 0.085 paid on Jun 13, 2014 going ex on May 20, 2014",05/20/2014,2021-07-20T00:00:00Z
NVDA.O,ExDividends,"NVDA.B Interim Cash Dividend of gross USD 0.085 paid on Jun 13, 2014 going ex on May 20, 2014",05/20/2014,2021-07-20T00:00:00Z
NVDA.O,ShareholderAndAnnualMeetings,NVIDIA Corporation 2014 Annual Shareholder Meeting,05/23/2014,2014-05-23T17:30:00Z
NVDA.O,ConferencePresentations,NVIDIA Corporation at Bank of America Merrill Lynch Global Technology Conference,06/03/2014,2014-06-04T12:20:10Z
NVDA.O,EarningsReleases,Q2 2015 NVIDIA Corporation Earnings Release,08/07/2014,2014-07-24T21:21:44Z
NVDA.O,EarningsCallsAndPresentations,Q2 2015 NVIDIA Corp Earnings Call,08/07/2014,2014-08-08T12:42:44Z
NVDA.O,ConferencePresentations,NVIDIA Corp at Pacific Crest Global Technology Leadership Forum,08/12/2014,2014-09-10T19:23:52Z
NVDA.O,ExDividends,"NVDAEUR.SGp^L17 Interim Cash Dividend of gross USD 0.085 paid on Sep 12, 2014 going ex on Aug 19, 2014",08/19/2014,2021-07-20T00:00:00Z
NVDA.O,ExDividends,"NVDA.DEU Interim Cash Dividend of gross USD 0.085 paid on Sep 12, 2014 going ex on Aug 19, 2014",08/19/2014,2021-07-20T00:00:00Z
NVDA.O,ExDividends,"NVDA.TG Interim Cash Dividend of gross USD 0.085 paid on Sep 12, 2014 going ex on Aug 19, 2014",08/19/2014,2021-07-20T00:00:00Z
NVDA.O,ExDividends,"NVDA.DY Interim Cash Dividend of gross USD 0.085 paid on Sep 12, 2014 going ex on Aug 19, 2014",08/19/2014,2021-07-20T00:00:00Z
NVDA.O,ExDividends,"NVDA.DG Interim Cash Dividend of gross USD 0.085 paid on Sep 12, 2014 going ex on Aug 19, 2014",08/19/2014,2021-07-20T00:00:00Z
NVDA.O,ExDividends,"NVDA.A Interim Cash Dividend of gross USD 0.085 paid on Sep 12, 2014 going ex on Aug 19, 2014",08/19/2014,2021-07-20T00:00:00Z
NVDA.O,ExDividends,"NVDA.PH Interim Cash Dividend of gross USD 0.085 paid on Sep 12, 2014 going ex on Aug 19, 2014",08/19/2014,2021-07-20T00:00:00Z
NVDA.O,ExDividends,"NVDA.ZY Interim Cash Dividend of gross USD 0.085 paid on Sep 12, 2014 going ex on Aug 19, 2014",08/19/2014,2021-07-20T00:00:00Z
NVDA.O,ExDividends,"NVDA.MX Interim Cash Dividend of gross USD 0.085 paid on Sep 12, 2014 going ex on Aug 19, 2014",08/19/2014,2021-07-20T00:00:00Z
NVDA.O,ExDividends,"NVDA.NB Interim Cash Dividend of gross USD 0.085 paid on Sep 12, 2014 going ex on Aug 19, 2014",08/19/2014,2021-07-20T00:00:00Z
NVDA.O,ExDividends,"NVDA.BN Interim Cash Dividend of gross USD 0.085 paid on Sep 12, 2014 going ex on Aug 19, 2014",08/19/2014,2021-07-20T00:00:00Z
NVDA.O,ExDividends,"NVDA.DF Interim Cash Dividend of gross USD 0.085 paid on Sep 12, 2014 going ex on Aug 19, 2014",08/19/2014,2021-07-20T00:00:00Z
NVDA.O,ExDividends,"NVDA.OQ Interim Cash Dividend of gross USD 0.085 paid on Sep 12, 2014 going ex on Aug 19, 2014",08/19/2014,2021-07-20T00:00:00Z
NVDA.O,ExDividends,"NVDA.D Interim Cash Dividend of gross USD 0.085 paid on Sep 12, 2014 going ex on Aug 19, 2014",08/19/2014,2021-07-20T00:00:00Z
NVDA.O,ExDividends,"NVDA.BE Interim Cash Dividend of gross USD 0.085 paid on Sep 12, 2014 going ex on Aug 19, 2014",08/19/2014,2021-07-20T00:00:00Z
NVDA.O,ExDividends,"NVDA.F Interim Cash Dividend of gross USD 0.085 paid on Sep 12, 2014 going ex on Aug 19, 2014",08/19/2014,2021-07-20T00:00:00Z
NVDA.O,ExDividends,"NVDA.P Interim Cash Dividend of gross USD 0.085 paid on Sep 12, 2014 going ex on Aug 19, 2014",08/19/2014,2021-07-20T00:00:00Z
NVDA.O,ExDividends,"NVDA.MU Interim Cash Dividend of gross USD 0.085 paid on Sep 12, 2014 going ex on Aug 19, 2014",08/19/2014,2021-07-20T00:00:00Z
NVDA.O,ExDividends,"NVDA.MW Interim Cash Dividend of gross USD 0.085 paid on Sep 12, 2014 going ex on Aug 19, 2014",08/19/2014,2021-07-20T00:00:00Z
NVDA.O,ExDividends,"NVDA.SG Interim Cash Dividend of gross USD 0.085 paid on Sep 12, 2014 going ex on Aug 19, 2014",08/19/2014,2021-07-20T00:00:00Z
NVDA.O,ExDividends,"NVDA.H Interim Cash Dividend of gross USD 0.085 paid on Sep 12, 2014 going ex on Aug 19, 2014",08/19/2014,2021-07-20T00:00:00Z
NVDA.O,ExDividends,"NVDA.O Interim Cash Dividend of gross USD 0.085 paid on Sep 12, 2014 going ex on Aug 19, 2014",08/19/2014,2021-07-20T00:00:00Z
NVDA.O,ExDividends,"NVDAEUR.DEp^A18 Interim Cash Dividend of gross USD 0.085 paid on Sep 12, 2014 going ex on Aug 19, 2014",08/19/2014,2021-07-20T00:00:00Z
NVDA.O,ExDividends,"NVDA.Z Interim Cash Dividend of gross USD 0.085 paid on Sep 12, 2014 going ex on Aug 19, 2014",08/19/2014,2021-07-20T00:00:00Z
NVDA.O,ExDividends,"NVDA.B Interim Cash Dividend of gross USD 0.085 paid on Sep 12, 2014 going ex on Aug 19, 2014",08/19/2014,2021-07-20T00:00:00Z
NVDA.O,ConferencePresentations,NVIDIA Corp at B. Riley Silicon Valley Tech Tour,08/25/2014,2014-08-18T12:29:13Z
NVDA.O,CorporateCallsAndPresentations,NVIDIA Conference Call to Discuss  Complaints Filed Against Samsung and Qualcomm for Infringing Its GPU Patents,09/04/2014,2014-09-05T21:28:12Z
NVDA.O,EarningsReleases,Q3 2015 NVIDIA Corp Earnings Release,11/06/2014,2014-10-23T21:13:33Z
NVDA.O,EarningsCallsAndPresentations,Q3 2015 NVIDIA Corp Earnings Call,11/06/2014,2014-11-07T19:40:01Z
NVDA.O,ConferencePresentations,NVIDIA Corp at UBS Global Technology Conference,11/18/2014,2015-03-02T21:51:29Z
NVDA.O,ExDividends,"NVDAEUR.SGp^L17 Final Cash Dividend of gross USD 0.085 paid on Dec 15, 2014 going ex on Nov 19, 2014",11/19/2014,2021-07-20T00:00:00Z
NVDA.O,ExDividends,"NVDA.DEU Final Cash Dividend of gross USD 0.085 paid on Dec 15, 2014 going ex on Nov 19, 2014",11/19/2014,2021-07-20T00:00:00Z
NVDA.O,ExDividends,"NVDA.TG Final Cash Dividend of gross USD 0.085 paid on Dec 15, 2014 going ex on Nov 19, 2014",11/19/2014,2021-07-20T00:00:00Z
NVDA.O,ExDividends,"NVDA.DY Final Cash Dividend of gross USD 0.085 paid on Dec 15, 2014 going ex on Nov 19, 2014",11/19/2014,2021-07-20T00:00:00Z
NVDA.O,ExDividends,"NVDA.DG Final Cash Dividend of gross USD 0.085 paid on Dec 15, 2014 going ex on Nov 19, 2014",11/19/2014,2021-07-20T00:00:00Z
NVDA.O,ExDividends,"NVDA.A Final Cash Dividend of gross USD 0.085 paid on Dec 15, 2014 going ex on Nov 19, 2014",11/19/2014,2021-07-20T00:00:00Z
NVDA.O,ExDividends,"NVDA.PH Final Cash Dividend of gross USD 0.085 paid on Dec 15, 2014 going ex on Nov 19, 2014",11/19/2014,2021-07-20T00:00:00Z
NVDA.O,ExDividends,"NVDA.ZY Final Cash Dividend of gross USD 0.085 paid on Dec 15, 2014 going ex on Nov 19, 2014",11/19/2014,2021-07-20T00:00:00Z
NVDA.O,ExDividends,"NVDA.MX Final Cash Dividend of gross USD 0.085 paid on Dec 15, 2014 going ex on Nov 19, 2014",11/19/2014,2021-07-20T00:00:00Z
NVDA.O,ExDividends,"NVDA.NB Final Cash Dividend of gross USD 0.085 paid on Dec 15, 2014 going ex on Nov 19, 2014",11/19/2014,2021-07-20T00:00:00Z
NVDA.O,ExDividends,"NVDA.BN Final Cash Dividend of gross USD 0.085 paid on Dec 15, 2014 going ex on Nov 19, 2014",11/19/2014,2021-07-20T00:00:00Z
NVDA.O,ExDividends,"NVDA.S Final Cash Dividend of gross USD 0.085 paid on Dec 15, 2014 going ex on Nov 19, 2014",11/19/2014,2021-07-20T00:00:00Z
NVDA.O,ExDividends,"NVDACHF.Lp^K14 Final Cash Dividend of gross USD 0.085 paid on Dec 15, 2014 going ex on Nov 19, 2014",11/19/2014,2021-07-20T00:00:00Z
NVDA.O,ExDividends,"NVDA.DF Final Cash Dividend of gross USD 0.085 paid on Dec 15, 2014 going ex on Nov 19, 2014",11/19/2014,2021-07-20T00:00:00Z
NVDA.O,ExDividends,"NVDA.OQ Final Cash Dividend of gross USD 0.085 paid on Dec 15, 2014 going ex on Nov 19, 2014",11/19/2014,2021-07-20T00:00:00Z
NVDA.O,ExDividends,"NVDA.D Final Cash Dividend of gross USD 0.085 paid on Dec 15, 2014 going ex on Nov 19, 2014",11/19/2014,2021-07-20T00:00:00Z
NVDA.O,ExDividends,"NVDA.BE Final Cash Dividend of gross USD 0.085 paid on Dec 15, 2014 going ex on Nov 19, 2014",11/19/2014,2021-07-20T00:00:00Z
NVDA.O,ExDividends,"NVDA.F Final Cash Dividend of gross USD 0.085 paid on Dec 15, 2014 going ex on Nov 19, 2014",11/19/2014,2021-07-20T00:00:00Z
NVDA.O,ExDividends,"NVDA.P Final Cash Dividend of gross USD 0.085 paid on Dec 15, 2014 going ex on Nov 19, 2014",11/19/2014,2021-07-20T00:00:00Z
NVDA.O,ExDividends,"NVDA.MU Final Cash Dividend of gross USD 0.085 paid on Dec 15, 2014 going ex on Nov 19, 2014",11/19/2014,2021-07-20T00:00:00Z
NVDA.O,ExDividends,"NVDA.MW Final Cash Dividend of gross USD 0.085 paid on Dec 15, 2014 going ex on Nov 19, 2014",11/19/2014,2021-07-20T00:00:00Z
NVDA.O,ExDividends,"NVDA.SG Final Cash Dividend of gross USD 0.085 paid on Dec 15, 2014 going ex on Nov 19, 2014",11/19/2014,2021-07-20T00:00:00Z
NVDA.O,ExDividends,"NVDA.H Final Cash Dividend of gross USD 0.085 paid on Dec 15, 2014 going ex on Nov 19, 2014",11/19/2014,2021-07-20T00:00:00Z
NVDA.O,ExDividends,"NVDA.O Final Cash Dividend of gross USD 0.085 paid on Dec 15, 2014 going ex on Nov 19, 2014",11/19/2014,2021-07-20T00:00:00Z
NVDA.O,ExDividends,"NVDAEUR.DEp^A18 Final Cash Dividend of gross USD 0.085 paid on Dec 15, 2014 going ex on Nov 19, 2014",11/19/2014,2021-07-20T00:00:00Z
NVDA.O,ExDividends,"NVDA.Z Final Cash Dividend of gross USD 0.085 paid on Dec 15, 2014 going ex on Nov 19, 2014",11/19/2014,2021-07-20T00:00:00Z
NVDA.O,ExDividends,"NVDA.B Final Cash Dividend of gross USD 0.085 paid on Dec 15, 2014 going ex on Nov 19, 2014",11/19/2014,2021-07-20T00:00:00Z
NVDA.O,ConferencePresentations,NVIDIA Corp at BMO Capital Markets Technology & Digital Media Conference,12/09/2014,2015-01-05T23:17:33Z
NVDA.O,ConferencePresentations,NVIDIA Corp at Nomura@CES Conference,01/06/2015,2015-01-05T14:16:39Z
NVDA.O,ConferencePresentations,NVIDIA Corp at JPMorgan Tech Forum at CES Conference,01/06/2015,2015-01-09T14:11:27Z
NVDA.O,EarningsReleases,Q4 2015 NVIDIA Corp Earnings Release,02/11/2015,2015-01-14T19:07:10Z
NVDA.O,EarningsCallsAndPresentations,Q4 2015 NVIDIA Corp Earnings Call,02/11/2015,2015-03-20T19:27:09Z
NVDA.O,ExDividends,"NVDAEUR.SGp^L17 Interim Cash Dividend of gross USD 0.085 paid on Mar 19, 2015 going ex on Feb 24, 2015",02/24/2015,2021-07-20T00:00:00Z
NVDA.O,ExDividends,"NVDA.DEU Interim Cash Dividend of gross USD 0.085 paid on Mar 19, 2015 going ex on Feb 24, 2015",02/24/2015,2021-07-20T00:00:00Z
NVDA.O,ExDividends,"NVDA.TG Interim Cash Dividend of gross USD 0.085 paid on Mar 19, 2015 going ex on Feb 24, 2015",02/24/2015,2021-07-20T00:00:00Z
NVDA.O,ExDividends,"NVDA.DY Interim Cash Dividend of gross USD 0.085 paid on Mar 19, 2015 going ex on Feb 24, 2015",02/24/2015,2021-07-20T00:00:00Z
NVDA.O,ExDividends,"NVDA.DG Interim Cash Dividend of gross USD 0.085 paid on Mar 19, 2015 going ex on Feb 24, 2015",02/24/2015,2021-07-20T00:00:00Z
NVDA.O,ExDividends,"NVDA.A Interim Cash Dividend of gross USD 0.085 paid on Mar 19, 2015 going ex on Feb 24, 2015",02/24/2015,2021-07-20T00:00:00Z
NVDA.O,ExDividends,"NVDA.PH Interim Cash Dividend of gross USD 0.085 paid on Mar 19, 2015 going ex on Feb 24, 2015",02/24/2015,2021-07-20T00:00:00Z
NVDA.O,ExDividends,"NVDA.ZY Interim Cash Dividend of gross USD 0.085 paid on Mar 19, 2015 going ex on Feb 24, 2015",02/24/2015,2021-07-20T00:00:00Z
NVDA.O,ExDividends,"NVDA.MX Interim Cash Dividend of gross USD 0.085 paid on Mar 19, 2015 going ex on Feb 24, 2015",02/24/2015,2021-07-20T00:00:00Z
NVDA.O,ExDividends,"NVDA.NB Interim Cash Dividend of gross USD 0.085 paid on Mar 19, 2015 going ex on Feb 24, 2015",02/24/2015,2021-07-20T00:00:00Z
NVDA.O,ExDividends,"NVDA.BN Interim Cash Dividend of gross USD 0.085 paid on Mar 19, 2015 going ex on Feb 24, 2015",02/24/2015,2021-07-20T00:00:00Z
NVDA.O,ExDividends,"NVDA.S Interim Cash Dividend of gross USD 0.085 paid on Mar 19, 2015 going ex on Feb 24, 2015",02/24/2015,2021-07-20T00:00:00Z
NVDA.O,ExDividends,"NVDA.DF Interim Cash Dividend of gross USD 0.085 paid on Mar 19, 2015 going ex on Feb 24, 2015",02/24/2015,2021-07-20T00:00:00Z
NVDA.O,ExDividends,"NVDA.OQ Interim Cash Dividend of gross USD 0.085 paid on Mar 19, 2015 going ex on Feb 24, 2015",02/24/2015,2021-07-20T00:00:00Z
NVDA.O,ExDividends,"NVDA.D Interim Cash Dividend of gross USD 0.085 paid on Mar 19, 2015 going ex on Feb 24, 2015",02/24/2015,2021-07-20T00:00:00Z
NVDA.O,ExDividends,"NVDA.BE Interim Cash Dividend of gross USD 0.085 paid on Mar 19, 2015 going ex on Feb 24, 2015",02/24/2015,2021-07-20T00:00:00Z
NVDA.O,ExDividends,"NVDA.F Interim Cash Dividend of gross USD 0.085 paid on Mar 19, 2015 going ex on Feb 24, 2015",02/24/2015,2021-07-20T00:00:00Z
NVDA.O,ExDividends,"NVDA.P Interim Cash Dividend of gross USD 0.085 paid on Mar 19, 2015 going ex on Feb 24, 2015",02/24/2015,2021-07-20T00:00:00Z
NVDA.O,ExDividends,"NVDA.MU Interim Cash Dividend of gross USD 0.085 paid on Mar 19, 2015 going ex on Feb 24, 2015",02/24/2015,2021-07-20T00:00:00Z
NVDA.O,ExDividends,"NVDA.MW Interim Cash Dividend of gross USD 0.085 paid on Mar 19, 2015 going ex on Feb 24, 2015",02/24/2015,2021-07-20T00:00:00Z
NVDA.O,ExDividends,"NVDA.SG Interim Cash Dividend of gross USD 0.085 paid on Mar 19, 2015 going ex on Feb 24, 2015",02/24/2015,2021-07-20T00:00:00Z
NVDA.O,ExDividends,"NVDA.H Interim Cash Dividend of gross USD 0.085 paid on Mar 19, 2015 going ex on Feb 24, 2015",02/24/2015,2021-07-20T00:00:00Z
NVDA.O,ExDividends,"NVDA.O Interim Cash Dividend of gross USD 0.085 paid on Mar 19, 2015 going ex on Feb 24, 2015",02/24/2015,2021-07-20T00:00:00Z
NVDA.O,ExDividends,"NVDAEUR.DEp^A18 Interim Cash Dividend of gross USD 0.085 paid on Mar 19, 2015 going ex on Feb 24, 2015",02/24/2015,2021-07-20T00:00:00Z
NVDA.O,ExDividends,"NVDA.Z Interim Cash Dividend of gross USD 0.085 paid on Mar 19, 2015 going ex on Feb 24, 2015",02/24/2015,2021-07-20T00:00:00Z
NVDA.O,ExDividends,"NVDA.B Interim Cash Dividend of gross USD 0.085 paid on Mar 19, 2015 going ex on Feb 24, 2015",02/24/2015,2021-07-20T00:00:00Z
NVDA.O,CorporateAnalystMeetings,NVIDIA Corp Investor Day,03/17/2015,2016-07-19T22:50:31Z
NVDA.O,EarningsReleases,Q1 2016 NVIDIA Corp Earnings Release,05/07/2015,2015-04-23T21:44:22Z
NVDA.O,EarningsCallsAndPresentations,Q1 2016 NVIDIA Corp Earnings Call,05/07/2015,2015-05-20T18:45:09Z
NVDA.O,ExDividends,"NVDAEUR.SGp^L17 Interim Cash Dividend of gross USD 0.0975 paid on Jun 12, 2015 going ex on May 19, 2015",05/19/2015,2021-07-20T00:00:00Z
NVDA.O,ExDividends,"NVDA.DEU Interim Cash Dividend of gross USD 0.0975 paid on Jun 12, 2015 going ex on May 19, 2015",05/19/2015,2021-07-20T00:00:00Z
NVDA.O,ExDividends,"NVDA.TG Interim Cash Dividend of gross USD 0.0975 paid on Jun 12, 2015 going ex on May 19, 2015",05/19/2015,2021-07-20T00:00:00Z
NVDA.O,ExDividends,"NVDA.DY Interim Cash Dividend of gross USD 0.0975 paid on Jun 12, 2015 going ex on May 19, 2015",05/19/2015,2021-07-20T00:00:00Z
NVDA.O,ExDividends,"NVDA.DG Interim Cash Dividend of gross USD 0.0975 paid on Jun 12, 2015 going ex on May 19, 2015",05/19/2015,2021-07-20T00:00:00Z
NVDA.O,ExDividends,"NVDA.A Interim Cash Dividend of gross USD 0.0975 paid on Jun 12, 2015 going ex on May 19, 2015",05/19/2015,2021-07-20T00:00:00Z
NVDA.O,ExDividends,"NVDA.PH Interim Cash Dividend of gross USD 0.0975 paid on Jun 12, 2015 going ex on May 19, 2015",05/19/2015,2021-07-20T00:00:00Z
NVDA.O,ExDividends,"NVDA.ZY Interim Cash Dividend of gross USD 0.0975 paid on Jun 12, 2015 going ex on May 19, 2015",05/19/2015,2021-07-20T00:00:00Z
NVDA.O,ExDividends,"NVDA.MX Interim Cash Dividend of gross USD 0.0975 paid on Jun 12, 2015 going ex on May 19, 2015",05/19/2015,2021-07-20T00:00:00Z
NVDA.O,ExDividends,"NVDA.NB Interim Cash Dividend of gross USD 0.0975 paid on Jun 12, 2015 going ex on May 19, 2015",05/19/2015,2021-07-20T00:00:00Z
NVDA.O,ExDividends,"NVDA.BN Interim Cash Dividend of gross USD 0.0975 paid on Jun 12, 2015 going ex on May 19, 2015",05/19/2015,2021-07-20T00:00:00Z
NVDA.O,ExDividends,"NVDA.S Interim Cash Dividend of gross USD 0.0975 paid on Jun 12, 2015 going ex on May 19, 2015",05/19/2015,2021-07-20T00:00:00Z
NVDA.O,ExDividends,"NVDA.DF Interim Cash Dividend of gross USD 0.0975 paid on Jun 12, 2015 going ex on May 19, 2015",05/19/2015,2021-07-20T00:00:00Z
NVDA.O,ExDividends,"NVDA.OQ Interim Cash Dividend of gross USD 0.0975 paid on Jun 12, 2015 going ex on May 19, 2015",05/19/2015,2021-07-20T00:00:00Z
NVDA.O,ExDividends,"NVDA.D Interim Cash Dividend of gross USD 0.0975 paid on Jun 12, 2015 going ex on May 19, 2015",05/19/2015,2021-07-20T00:00:00Z
NVDA.O,ExDividends,"NVDA.BE Interim Cash Dividend of gross USD 0.0975 paid on Jun 12, 2015 going ex on May 19, 2015",05/19/2015,2021-07-20T00:00:00Z
NVDA.O,ExDividends,"NVDA.F Interim Cash Dividend of gross USD 0.0975 paid on Jun 12, 2015 going ex on May 19, 2015",05/19/2015,2021-07-20T00:00:00Z
NVDA.O,ExDividends,"NVDA.P Interim Cash Dividend of gross USD 0.0975 paid on Jun 12, 2015 going ex on May 19, 2015",05/19/2015,2021-07-20T00:00:00Z
NVDA.O,ExDividends,"NVDA.MU Interim Cash Dividend of gross USD 0.0975 paid on Jun 12, 2015 going ex on May 19, 2015",05/19/2015,2021-07-20T00:00:00Z
NVDA.O,ExDividends,"NVDA.MW Interim Cash Dividend of gross USD 0.0975 paid on Jun 12, 2015 going ex on May 19, 2015",05/19/2015,2021-07-20T00:00:00Z
NVDA.O,ExDividends,"NVDA.SG Interim Cash Dividend of gross USD 0.0975 paid on Jun 12, 2015 going ex on May 19, 2015",05/19/2015,2021-07-20T00:00:00Z
NVDA.O,ExDividends,"NVDA.H Interim Cash Dividend of gross USD 0.0975 paid on Jun 12, 2015 going ex on May 19, 2015",05/19/2015,2021-07-20T00:00:00Z
NVDA.O,ExDividends,"NVDA.O Interim Cash Dividend of gross USD 0.0975 paid on Jun 12, 2015 going ex on May 19, 2015",05/19/2015,2021-07-20T00:00:00Z
NVDA.O,ExDividends,"NVDAEUR.DEp^A18 Interim Cash Dividend of gross USD 0.0975 paid on Jun 12, 2015 going ex on May 19, 2015",05/19/2015,2021-07-20T00:00:00Z
NVDA.O,ExDividends,"NVDA.Z Interim Cash Dividend of gross USD 0.0975 paid on Jun 12, 2015 going ex on May 19, 2015",05/19/2015,2021-07-20T00:00:00Z
NVDA.O,ExDividends,"NVDA.B Interim Cash Dividend of gross USD 0.0975 paid on Jun 12, 2015 going ex on May 19, 2015",05/19/2015,2021-07-20T00:00:00Z
NVDA.O,ShareholderAndAnnualMeetings,NVIDIA Corp Annual Shareholders Meeting,05/20/2015,2015-05-08T21:28:21Z
NVDA.O,ConferencePresentations,NVIDIA Corp at Bank of America Merrill Lynch Global Technology Conference,06/02/2015,2015-06-03T04:19:18Z
NVDA.O,EarningsReleases,Q2 2016 NVIDIA Corp Earnings Release,08/06/2015,2015-07-23T21:15:51Z
NVDA.O,EarningsCallsAndPresentations,Q2 2016 NVIDIA Corp Earnings Call,08/06/2015,2015-08-10T13:15:31Z
NVDA.O,ExDividends,"NVDAEUR.SGp^L17 Interim Cash Dividend of gross USD 0.0975 paid on Sep 11, 2015 going ex on Aug 18, 2015",08/18/2015,2021-07-20T00:00:00Z
NVDA.O,ExDividends,"NVDA.DEU Interim Cash Dividend of gross USD 0.0975 paid on Sep 11, 2015 going ex on Aug 18, 2015",08/18/2015,2021-07-20T00:00:00Z
NVDA.O,ExDividends,"NVDA.TG Interim Cash Dividend of gross USD 0.0975 paid on Sep 11, 2015 going ex on Aug 18, 2015",08/18/2015,2021-07-20T00:00:00Z
NVDA.O,ExDividends,"NVDA.DY Interim Cash Dividend of gross USD 0.0975 paid on Sep 11, 2015 going ex on Aug 18, 2015",08/18/2015,2021-07-20T00:00:00Z
NVDA.O,ExDividends,"NVDA.DG Interim Cash Dividend of gross USD 0.0975 paid on Sep 11, 2015 going ex on Aug 18, 2015",08/18/2015,2021-07-20T00:00:00Z
NVDA.O,ExDividends,"NVDA.A Interim Cash Dividend of gross USD 0.0975 paid on Sep 11, 2015 going ex on Aug 18, 2015",08/18/2015,2021-07-20T00:00:00Z
NVDA.O,ExDividends,"NVDA.PH Interim Cash Dividend of gross USD 0.0975 paid on Sep 11, 2015 going ex on Aug 18, 2015",08/18/2015,2021-07-20T00:00:00Z
NVDA.O,ExDividends,"NVDA.ZY Interim Cash Dividend of gross USD 0.0975 paid on Sep 11, 2015 going ex on Aug 18, 2015",08/18/2015,2021-07-20T00:00:00Z
NVDA.O,ExDividends,"NVDA.MX Interim Cash Dividend of gross USD 0.0975 paid on Sep 11, 2015 going ex on Aug 18, 2015",08/18/2015,2021-07-20T00:00:00Z
NVDA.O,ExDividends,"NVDA.NB Interim Cash Dividend of gross USD 0.0975 paid on Sep 11, 2015 going ex on Aug 18, 2015",08/18/2015,2021-07-20T00:00:00Z
NVDA.O,ExDividends,"NVDA.BN Interim Cash Dividend of gross USD 0.0975 paid on Sep 11, 2015 going ex on Aug 18, 2015",08/18/2015,2021-07-20T00:00:00Z
NVDA.O,ExDividends,"NVDA.S Interim Cash Dividend of gross USD 0.0975 paid on Sep 11, 2015 going ex on Aug 18, 2015",08/18/2015,2021-07-20T00:00:00Z
NVDA.O,ExDividends,"NVDA.DF Interim Cash Dividend of gross USD 0.0975 paid on Sep 11, 2015 going ex on Aug 18, 2015",08/18/2015,2021-07-20T00:00:00Z
NVDA.O,ExDividends,"NVDA.OQ Interim Cash Dividend of gross USD 0.0975 paid on Sep 11, 2015 going ex on Aug 18, 2015",08/18/2015,2021-07-20T00:00:00Z
NVDA.O,ExDividends,"NVDA.D Interim Cash Dividend of gross USD 0.0975 paid on Sep 11, 2015 going ex on Aug 18, 2015",08/18/2015,2021-07-20T00:00:00Z
NVDA.O,ExDividends,"NVDA.BE Interim Cash Dividend of gross USD 0.0975 paid on Sep 11, 2015 going ex on Aug 18, 2015",08/18/2015,2021-07-20T00:00:00Z
NVDA.O,ExDividends,"NVDA.F Interim Cash Dividend of gross USD 0.0975 paid on Sep 11, 2015 going ex on Aug 18, 2015",08/18/2015,2021-07-20T00:00:00Z
NVDA.O,ExDividends,"NVDA.P Interim Cash Dividend of gross USD 0.0975 paid on Sep 11, 2015 going ex on Aug 18, 2015",08/18/2015,2021-07-20T00:00:00Z
NVDA.O,ExDividends,"NVDA.MU Interim Cash Dividend of gross USD 0.0975 paid on Sep 11, 2015 going ex on Aug 18, 2015",08/18/2015,2021-07-20T00:00:00Z
NVDA.O,ExDividends,"NVDA.MW Interim Cash Dividend of gross USD 0.0975 paid on Sep 11, 2015 going ex on Aug 18, 2015",08/18/2015,2021-07-20T00:00:00Z
NVDA.O,ExDividends,"NVDA.SG Interim Cash Dividend of gross USD 0.0975 paid on Sep 11, 2015 going ex on Aug 18, 2015",08/18/2015,2021-07-20T00:00:00Z
NVDA.O,ExDividends,"NVDA.H Interim Cash Dividend of gross USD 0.0975 paid on Sep 11, 2015 going ex on Aug 18, 2015",08/18/2015,2021-07-20T00:00:00Z
NVDA.O,ExDividends,"NVDA.O Interim Cash Dividend of gross USD 0.0975 paid on Sep 11, 2015 going ex on Aug 18, 2015",08/18/2015,2021-07-20T00:00:00Z
NVDA.O,ExDividends,"NVDAEUR.DEp^A18 Interim Cash Dividend of gross USD 0.0975 paid on Sep 11, 2015 going ex on Aug 18, 2015",08/18/2015,2021-07-20T00:00:00Z
NVDA.O,ExDividends,"NVDA.Z Interim Cash Dividend of gross USD 0.0975 paid on Sep 11, 2015 going ex on Aug 18, 2015",08/18/2015,2021-07-20T00:00:00Z
NVDA.O,ExDividends,"NVDA.B Interim Cash Dividend of gross USD 0.0975 paid on Sep 11, 2015 going ex on Aug 18, 2015",08/18/2015,2021-07-20T00:00:00Z
NVDA.O,ConferencePresentations,NVIDIA Corp at Citi Global Technology Conference,09/09/2015,2015-09-10T03:01:32Z
NVDA.O,ConferencePresentations,NVIDIA Corp at Deutsche Bank Technology Conference,09/16/2015,2015-09-30T17:48:17Z
NVDA.O,EarningsReleases,Q3 2016 NVIDIA Corp Earnings Release,11/05/2015,2015-10-22T21:44:36Z
NVDA.O,EarningsCallsAndPresentations,Q3 2016 NVIDIA Corp Earnings Call,11/05/2015,2016-01-12T17:50:23Z
NVDA.O,ExDividends,"NVDAEUR.SGp^L17 Final Cash Dividend of gross USD 0.115 paid on Dec 14, 2015 going ex on Nov 18, 2015",11/18/2015,2021-07-20T00:00:00Z
NVDA.O,ExDividends,"NVDA.DEU Final Cash Dividend of gross USD 0.115 paid on Dec 14, 2015 going ex on Nov 18, 2015",11/18/2015,2021-07-20T00:00:00Z
NVDA.O,ExDividends,"NVDA.TG Final Cash Dividend of gross USD 0.115 paid on Dec 14, 2015 going ex on Nov 18, 2015",11/18/2015,2021-07-20T00:00:00Z
NVDA.O,ExDividends,"NVDA.DY Final Cash Dividend of gross USD 0.115 paid on Dec 14, 2015 going ex on Nov 18, 2015",11/18/2015,2021-07-20T00:00:00Z
NVDA.O,ExDividends,"NVDA.DG Final Cash Dividend of gross USD 0.115 paid on Dec 14, 2015 going ex on Nov 18, 2015",11/18/2015,2021-07-20T00:00:00Z
NVDA.O,ExDividends,"NVDA.A Final Cash Dividend of gross USD 0.115 paid on Dec 14, 2015 going ex on Nov 18, 2015",11/18/2015,2021-07-20T00:00:00Z
NVDA.O,ExDividends,"NVDA.PH Final Cash Dividend of gross USD 0.115 paid on Dec 14, 2015 going ex on Nov 18, 2015",11/18/2015,2021-07-20T00:00:00Z
NVDA.O,ExDividends,"NVDA.ZY Final Cash Dividend of gross USD 0.115 paid on Dec 14, 2015 going ex on Nov 18, 2015",11/18/2015,2021-07-20T00:00:00Z
NVDA.O,ExDividends,"NVDA.MX Final Cash Dividend of gross USD 0.115 paid on Dec 14, 2015 going ex on Nov 18, 2015",11/18/2015,2021-07-20T00:00:00Z
NVDA.O,ExDividends,"NVDA.NB Final Cash Dividend of gross USD 0.115 paid on Dec 14, 2015 going ex on Nov 18, 2015",11/18/2015,2021-07-20T00:00:00Z
NVDA.O,ExDividends,"NVDA.BN Final Cash Dividend of gross USD 0.115 paid on Dec 14, 2015 going ex on Nov 18, 2015",11/18/2015,2021-07-20T00:00:00Z
NVDA.O,ExDividends,"NVDA.S Final Cash Dividend of gross USD 0.115 paid on Dec 14, 2015 going ex on Nov 18, 2015",11/18/2015,2021-07-20T00:00:00Z
NVDA.O,ExDividends,"NVDA.DF Final Cash Dividend of gross USD 0.115 paid on Dec 14, 2015 going ex on Nov 18, 2015",11/18/2015,2021-07-20T00:00:00Z
NVDA.O,ExDividends,"NVDA.OQ Final Cash Dividend of gross USD 0.115 paid on Dec 14, 2015 going ex on Nov 18, 2015",11/18/2015,2021-07-20T00:00:00Z
NVDA.O,ExDividends,"NVDA.D Final Cash Dividend of gross USD 0.115 paid on Dec 14, 2015 going ex on Nov 18, 2015",11/18/2015,2021-07-20T00:00:00Z
NVDA.O,ExDividends,"NVDA.BE Final Cash Dividend of gross USD 0.115 paid on Dec 14, 2015 going ex on Nov 18, 2015",11/18/2015,2021-07-20T00:00:00Z
NVDA.O,ExDividends,"NVDA.F Final Cash Dividend of gross USD 0.115 paid on Dec 14, 2015 going ex on Nov 18, 2015",11/18/2015,2021-07-20T00:00:00Z
NVDA.O,ExDividends,"NVDA.P Final Cash Dividend of gross USD 0.115 paid on Dec 14, 2015 going ex on Nov 18, 2015",11/18/2015,2021-07-20T00:00:00Z
NVDA.O,ExDividends,"NVDA.MU Final Cash Dividend of gross USD 0.115 paid on Dec 14, 2015 going ex on Nov 18, 2015",11/18/2015,2021-07-20T00:00:00Z
NVDA.O,ExDividends,"NVDA.MW Final Cash Dividend of gross USD 0.115 paid on Dec 14, 2015 going ex on Nov 18, 2015",11/18/2015,2021-07-20T00:00:00Z
NVDA.O,ExDividends,"NVDA.SG Final Cash Dividend of gross USD 0.115 paid on Dec 14, 2015 going ex on Nov 18, 2015",11/18/2015,2021-07-20T00:00:00Z
NVDA.O,ExDividends,"NVDA.H Final Cash Dividend of gross USD 0.115 paid on Dec 14, 2015 going ex on Nov 18, 2015",11/18/2015,2021-07-20T00:00:00Z
NVDA.O,ExDividends,"NVDA.O Final Cash Dividend of gross USD 0.115 paid on Dec 14, 2015 going ex on Nov 18, 2015",11/18/2015,2021-07-20T00:00:00Z
NVDA.O,ExDividends,"NVDAEUR.DEp^A18 Final Cash Dividend of gross USD 0.115 paid on Dec 14, 2015 going ex on Nov 18, 2015",11/18/2015,2021-07-20T00:00:00Z
NVDA.O,ExDividends,"NVDA.Z Final Cash Dividend of gross USD 0.115 paid on Dec 14, 2015 going ex on Nov 18, 2015",11/18/2015,2021-07-20T00:00:00Z
NVDA.O,ExDividends,"NVDA.B Final Cash Dividend of gross USD 0.115 paid on Dec 14, 2015 going ex on Nov 18, 2015",11/18/2015,2021-07-20T00:00:00Z
NVDA.O,ConferencePresentations,"NVIDIA Corp at Credit Suisse Technology, Media & Telecom Conference",12/02/2015,2015-12-02T20:32:55Z
NVDA.O,ConferencePresentations,NVIDIA Corp at Barclays Global Technology Conference,12/09/2015,2015-12-15T14:04:12Z
NVDA.O,ConferencePresentations,NVIDIA Corp at Nomura@CES Forum,01/05/2016,2015-12-22T13:26:41Z
NVDA.O,ConferencePresentations,NVIDIA Corp at JPMorgan Technology Forum,01/06/2016,2016-01-07T14:59:37Z
NVDA.O,EarningsReleases,Q4 2016 NVIDIA Corp Earnings Release,02/17/2016,2016-01-27T22:39:22Z
NVDA.O,EarningsCallsAndPresentations,Q4 2016 NVIDIA Corp Earnings Call,02/17/2016,2016-03-02T05:09:14Z
NVDA.O,ExDividends,"NVDAEUR.SGp^L17 Interim Cash Dividend of gross USD 0.115 paid on Mar 23, 2016 going ex on Feb 29, 2016",02/29/2016,2021-07-20T00:00:00Z
NVDA.O,ExDividends,"NVDA.DEU Interim Cash Dividend of gross USD 0.115 paid on Mar 23, 2016 going ex on Feb 29, 2016",02/29/2016,2021-07-20T00:00:00Z
NVDA.O,ExDividends,"NVDA.TG Interim Cash Dividend of gross USD 0.115 paid on Mar 23, 2016 going ex on Feb 29, 2016",02/29/2016,2021-07-20T00:00:00Z
NVDA.O,ExDividends,"NVDA.PH Interim Cash Dividend of gross USD 0.115 paid on Mar 23, 2016 going ex on Feb 29, 2016",02/29/2016,2021-07-20T00:00:00Z
NVDA.O,ExDividends,"NVDA.MX Interim Cash Dividend of gross USD 0.115 paid on Mar 23, 2016 going ex on Feb 29, 2016",02/29/2016,2021-07-20T00:00:00Z
NVDA.O,ExDividends,"NVDA.NB Interim Cash Dividend of gross USD 0.115 paid on Mar 23, 2016 going ex on Feb 29, 2016",02/29/2016,2021-07-20T00:00:00Z
NVDA.O,ExDividends,"NVDA.BN Interim Cash Dividend of gross USD 0.115 paid on Mar 23, 2016 going ex on Feb 29, 2016",02/29/2016,2021-07-20T00:00:00Z
NVDA.O,ExDividends,"NVDA.S Interim Cash Dividend of gross USD 0.115 paid on Mar 23, 2016 going ex on Feb 29, 2016",02/29/2016,2021-07-20T00:00:00Z
NVDA.O,ExDividends,"NVDA.DF Interim Cash Dividend of gross USD 0.115 paid on Mar 23, 2016 going ex on Feb 29, 2016",02/29/2016,2021-07-20T00:00:00Z
NVDA.O,ExDividends,"NVDA.OQ Interim Cash Dividend of gross USD 0.115 paid on Mar 23, 2016 going ex on Feb 29, 2016",02/29/2016,2021-07-20T00:00:00Z
NVDA.O,ExDividends,"NVDA.D Interim Cash Dividend of gross USD 0.115 paid on Mar 23, 2016 going ex on Feb 29, 2016",02/29/2016,2021-07-20T00:00:00Z
NVDA.O,ExDividends,"NVDA.BE Interim Cash Dividend of gross USD 0.115 paid on Mar 23, 2016 going ex on Feb 29, 2016",02/29/2016,2021-07-20T00:00:00Z
NVDA.O,ExDividends,"NVDA.F Interim Cash Dividend of gross USD 0.115 paid on Mar 23, 2016 going ex on Feb 29, 2016",02/29/2016,2021-07-20T00:00:00Z
NVDA.O,ExDividends,"NVDA.P Interim Cash Dividend of gross USD 0.115 paid on Mar 23, 2016 going ex on Feb 29, 2016",02/29/2016,2021-07-20T00:00:00Z
NVDA.O,ExDividends,"NVDA.MU Interim Cash Dividend of gross USD 0.115 paid on Mar 23, 2016 going ex on Feb 29, 2016",02/29/2016,2021-07-20T00:00:00Z
NVDA.O,ExDividends,"NVDA.C Interim Cash Dividend of gross USD 0.115 paid on Mar 23, 2016 going ex on Feb 29, 2016",02/29/2016,2021-07-20T00:00:00Z
NVDA.O,ExDividends,"NVDA.MW Interim Cash Dividend of gross USD 0.115 paid on Mar 23, 2016 going ex on Feb 29, 2016",02/29/2016,2021-07-20T00:00:00Z
NVDA.O,ExDividends,"NVDA.SG Interim Cash Dividend of gross USD 0.115 paid on Mar 23, 2016 going ex on Feb 29, 2016",02/29/2016,2021-07-20T00:00:00Z
NVDA.O,ExDividends,"NVDA.H Interim Cash Dividend of gross USD 0.115 paid on Mar 23, 2016 going ex on Feb 29, 2016",02/29/2016,2021-07-20T00:00:00Z
NVDA.O,ExDividends,"NVDA.O Interim Cash Dividend of gross USD 0.115 paid on Mar 23, 2016 going ex on Feb 29, 2016",02/29/2016,2021-07-20T00:00:00Z
NVDA.O,ExDividends,"NVDAEUR.DEp^A18 Interim Cash Dividend of gross USD 0.115 paid on Mar 23, 2016 going ex on Feb 29, 2016",02/29/2016,2021-07-20T00:00:00Z
NVDA.O,ExDividends,"NVDA.B Interim Cash Dividend of gross USD 0.115 paid on Mar 23, 2016 going ex on Feb 29, 2016",02/29/2016,2021-07-20T00:00:00Z
NVDA.O,ConferencePresentations,"NVIDIA Corp at Morgan Stanley Technology, Media & Telecom Conference",02/29/2016,2016-02-29T21:09:45Z
NVDA.O,ConferencePresentations,NVIDIA Corp at Raymond James Institutional Investors Conference,03/07/2016,2016-03-07T20:28:46Z
NVDA.O,CorporateAnalystMeetings,NVIDIA Corp Annual Investor Day,04/05/2016,2016-04-07T23:19:03Z
NVDA.O,EarningsReleases,Q1 2017 NVIDIA Corp Earnings Release,05/12/2016,2016-04-28T21:21:10Z
NVDA.O,EarningsCallsAndPresentations,Q1 2017 NVIDIA Corp Earnings Call,05/12/2016,2016-05-13T16:58:00Z
NVDA.O,ShareholderAndAnnualMeetings,NVIDIA Corp Annual Shareholders Meeting,05/18/2016,2016-04-08T19:26:53Z
NVDA.O,ConferencePresentations,NVIDIA Corp at Citi Car of the Future Symposium,05/19/2016,2016-05-17T11:13:36Z
NVDA.O,ExDividends,"NVDAEUR.SGp^L17 Interim Cash Dividend of gross USD 0.115 paid on Jun 20, 2016 going ex on May 24, 2016",05/24/2016,2021-07-20T00:00:00Z
NVDA.O,ExDividends,"NVDA.DEU Interim Cash Dividend of gross USD 0.115 paid on Jun 20, 2016 going ex on May 24, 2016",05/24/2016,2021-07-20T00:00:00Z
NVDA.O,ExDividends,"NVDA.TG Interim Cash Dividend of gross USD 0.115 paid on Jun 20, 2016 going ex on May 24, 2016",05/24/2016,2021-07-20T00:00:00Z
NVDA.O,ExDividends,"NVDA.DY Interim Cash Dividend of gross USD 0.115 paid on Jun 20, 2016 going ex on May 24, 2016",05/24/2016,2021-07-20T00:00:00Z
NVDA.O,ExDividends,"NVDA.DG Interim Cash Dividend of gross USD 0.115 paid on Jun 20, 2016 going ex on May 24, 2016",05/24/2016,2021-07-20T00:00:00Z
NVDA.O,ExDividends,"NVDA.A Interim Cash Dividend of gross USD 0.115 paid on Jun 20, 2016 going ex on May 24, 2016",05/24/2016,2021-07-20T00:00:00Z
NVDA.O,ExDividends,"NVDA.PH Interim Cash Dividend of gross USD 0.115 paid on Jun 20, 2016 going ex on May 24, 2016",05/24/2016,2021-07-20T00:00:00Z
NVDA.O,ExDividends,"NVDA.ZY Interim Cash Dividend of gross USD 0.115 paid on Jun 20, 2016 going ex on May 24, 2016",05/24/2016,2021-07-20T00:00:00Z
NVDA.O,ExDividends,"NVDA.MX Interim Cash Dividend of gross USD 0.115 paid on Jun 20, 2016 going ex on May 24, 2016",05/24/2016,2021-07-20T00:00:00Z
NVDA.O,ExDividends,"NVDA.NB Interim Cash Dividend of gross USD 0.115 paid on Jun 20, 2016 going ex on May 24, 2016",05/24/2016,2021-07-20T00:00:00Z
NVDA.O,ExDividends,"NVDA.BN Interim Cash Dividend of gross USD 0.115 paid on Jun 20, 2016 going ex on May 24, 2016",05/24/2016,2021-07-20T00:00:00Z
NVDA.O,ExDividends,"NVDA.S Interim Cash Dividend of gross USD 0.115 paid on Jun 20, 2016 going ex on May 24, 2016",05/24/2016,2021-07-20T00:00:00Z
NVDA.O,ExDividends,"NVDA.DF Interim Cash Dividend of gross USD 0.115 paid on Jun 20, 2016 going ex on May 24, 2016",05/24/2016,2021-07-20T00:00:00Z
NVDA.O,ExDividends,"NVDA.OQ Interim Cash Dividend of gross USD 0.115 paid on Jun 20, 2016 going ex on May 24, 2016",05/24/2016,2021-07-20T00:00:00Z
NVDA.O,ExDividends,"NVDA.D Interim Cash Dividend of gross USD 0.115 paid on Jun 20, 2016 going ex on May 24, 2016",05/24/2016,2021-07-20T00:00:00Z
NVDA.O,ExDividends,"NVDA.BE Interim Cash Dividend of gross USD 0.115 paid on Jun 20, 2016 going ex on May 24, 2016",05/24/2016,2021-07-20T00:00:00Z
NVDA.O,ExDividends,"NVDA.F Interim Cash Dividend of gross USD 0.115 paid on Jun 20, 2016 going ex on May 24, 2016",05/24/2016,2021-07-20T00:00:00Z
NVDA.O,ExDividends,"NVDA.P Interim Cash Dividend of gross USD 0.115 paid on Jun 20, 2016 going ex on May 24, 2016",05/24/2016,2021-07-20T00:00:00Z
NVDA.O,ExDividends,"NVDA.MU Interim Cash Dividend of gross USD 0.115 paid on Jun 20, 2016 going ex on May 24, 2016",05/24/2016,2021-07-20T00:00:00Z
NVDA.O,ExDividends,"NVDA.C Interim Cash Dividend of gross USD 0.115 paid on Jun 20, 2016 going ex on May 24, 2016",05/24/2016,2021-07-20T00:00:00Z
NVDA.O,ExDividends,"NVDA.MW Interim Cash Dividend of gross USD 0.115 paid on Jun 20, 2016 going ex on May 24, 2016",05/24/2016,2021-07-20T00:00:00Z
NVDA.O,ExDividends,"NVDA.SG Interim Cash Dividend of gross USD 0.115 paid on Jun 20, 2016 going ex on May 24, 2016",05/24/2016,2021-07-20T00:00:00Z
NVDA.O,ExDividends,"NVDA.H Interim Cash Dividend of gross USD 0.115 paid on Jun 20, 2016 going ex on May 24, 2016",05/24/2016,2021-07-20T00:00:00Z
NVDA.O,ExDividends,"NVDA.O Interim Cash Dividend of gross USD 0.115 paid on Jun 20, 2016 going ex on May 24, 2016",05/24/2016,2021-07-20T00:00:00Z
NVDA.O,ExDividends,"NVDAEUR.DEp^A18 Interim Cash Dividend of gross USD 0.115 paid on Jun 20, 2016 going ex on May 24, 2016",05/24/2016,2021-07-20T00:00:00Z
NVDA.O,ExDividends,"NVDA.Z Interim Cash Dividend of gross USD 0.115 paid on Jun 20, 2016 going ex on May 24, 2016",05/24/2016,2021-07-20T00:00:00Z
NVDA.O,ExDividends,"NVDA.B Interim Cash Dividend of gross USD 0.115 paid on Jun 20, 2016 going ex on May 24, 2016",05/24/2016,2021-07-20T00:00:00Z
NVDA.O,ConferencePresentations,NVIDIA Corp at Bank of America Merrill Lynch Global Technology Conference,06/01/2016,2016-06-28T19:01:47Z
NVDA.O,ConferencePresentations,NVIDIA Corp at Stifel Technology Internet & Media Conference,06/06/2016,2016-05-25T15:42:12Z
NVDA.O,EarningsReleases,Q2 2017 NVIDIA Corp Earnings Release,08/11/2016,2016-07-28T21:28:21Z
NVDA.O,EarningsCallsAndPresentations,Q2 2017 NVIDIA Corp Earnings Call,08/11/2016,2016-08-12T18:24:52Z
NVDA.O,ConferencePresentations,NVIDIA Corp at Mitsubishi UFJ Securities Technology Tour - Silicon Valley,08/15/2016,2016-08-08T14:32:50Z
NVDA.O,ExDividends,"NVDAEUR.SGp^L17 Interim Cash Dividend of gross USD 0.115 paid on Sep 16, 2016 going ex on Aug 23, 2016",08/23/2016,2021-07-20T00:00:00Z
NVDA.O,ExDividends,"NVDA.DEU Interim Cash Dividend of gross USD 0.115 paid on Sep 16, 2016 going ex on Aug 23, 2016",08/23/2016,2021-07-20T00:00:00Z
NVDA.O,ExDividends,"NVDA.TG Interim Cash Dividend of gross USD 0.115 paid on Sep 16, 2016 going ex on Aug 23, 2016",08/23/2016,2021-07-20T00:00:00Z
NVDA.O,ExDividends,"NVDA.DY Interim Cash Dividend of gross USD 0.115 paid on Sep 16, 2016 going ex on Aug 23, 2016",08/23/2016,2021-07-20T00:00:00Z
NVDA.O,ExDividends,"NVDA.DG Interim Cash Dividend of gross USD 0.115 paid on Sep 16, 2016 going ex on Aug 23, 2016",08/23/2016,2021-07-20T00:00:00Z
NVDA.O,ExDividends,"NVDA.A Interim Cash Dividend of gross USD 0.115 paid on Sep 16, 2016 going ex on Aug 23, 2016",08/23/2016,2021-07-20T00:00:00Z
NVDA.O,ExDividends,"NVDA.PH Interim Cash Dividend of gross USD 0.115 paid on Sep 16, 2016 going ex on Aug 23, 2016",08/23/2016,2021-07-20T00:00:00Z
NVDA.O,ExDividends,"NVDA.ZY Interim Cash Dividend of gross USD 0.115 paid on Sep 16, 2016 going ex on Aug 23, 2016",08/23/2016,2021-07-20T00:00:00Z
NVDA.O,ExDividends,"NVDA.MX Interim Cash Dividend of gross USD 0.115 paid on Sep 16, 2016 going ex on Aug 23, 2016",08/23/2016,2021-07-20T00:00:00Z
NVDA.O,ExDividends,"NVDA.NB Interim Cash Dividend of gross USD 0.115 paid on Sep 16, 2016 going ex on Aug 23, 2016",08/23/2016,2021-07-20T00:00:00Z
NVDA.O,ExDividends,"NVDA.BN Interim Cash Dividend of gross USD 0.115 paid on Sep 16, 2016 going ex on Aug 23, 2016",08/23/2016,2021-07-20T00:00:00Z
NVDA.O,ExDividends,"NVDA.S Interim Cash Dividend of gross USD 0.115 paid on Sep 16, 2016 going ex on Aug 23, 2016",08/23/2016,2021-07-20T00:00:00Z
NVDA.O,ExDividends,"NVDA.DF Interim Cash Dividend of gross USD 0.115 paid on Sep 16, 2016 going ex on Aug 23, 2016",08/23/2016,2021-07-20T00:00:00Z
NVDA.O,ExDividends,"NVDA.OQ Interim Cash Dividend of gross USD 0.115 paid on Sep 16, 2016 going ex on Aug 23, 2016",08/23/2016,2021-07-20T00:00:00Z
NVDA.O,ExDividends,"NVDA.D Interim Cash Dividend of gross USD 0.115 paid on Sep 16, 2016 going ex on Aug 23, 2016",08/23/2016,2021-07-20T00:00:00Z
NVDA.O,ExDividends,"NVDA.BE Interim Cash Dividend of gross USD 0.115 paid on Sep 16, 2016 going ex on Aug 23, 2016",08/23/2016,2021-07-20T00:00:00Z
NVDA.O,ExDividends,"NVDA.F Interim Cash Dividend of gross USD 0.115 paid on Sep 16, 2016 going ex on Aug 23, 2016",08/23/2016,2021-07-20T00:00:00Z
NVDA.O,ExDividends,"NVDA.P Interim Cash Dividend of gross USD 0.115 paid on Sep 16, 2016 going ex on Aug 23, 2016",08/23/2016,2021-07-20T00:00:00Z
NVDA.O,ExDividends,"NVDA.MU Interim Cash Dividend of gross USD 0.115 paid on Sep 16, 2016 going ex on Aug 23, 2016",08/23/2016,2021-07-20T00:00:00Z
NVDA.O,ExDividends,"NVDA.C Interim Cash Dividend of gross USD 0.115 paid on Sep 16, 2016 going ex on Aug 23, 2016",08/23/2016,2021-07-20T00:00:00Z
NVDA.O,ExDividends,"NVDA.MW Interim Cash Dividend of gross USD 0.115 paid on Sep 16, 2016 going ex on Aug 23, 2016",08/23/2016,2021-07-20T00:00:00Z
NVDA.O,ExDividends,"NVDA.SG Interim Cash Dividend of gross USD 0.115 paid on Sep 16, 2016 going ex on Aug 23, 2016",08/23/2016,2021-07-20T00:00:00Z
NVDA.O,ExDividends,"NVDA.H Interim Cash Dividend of gross USD 0.115 paid on Sep 16, 2016 going ex on Aug 23, 2016",08/23/2016,2021-07-20T00:00:00Z
NVDA.O,ExDividends,"NVDA.O Interim Cash Dividend of gross USD 0.115 paid on Sep 16, 2016 going ex on Aug 23, 2016",08/23/2016,2021-07-20T00:00:00Z
NVDA.O,ExDividends,"NVDAEUR.DEp^A18 Interim Cash Dividend of gross USD 0.115 paid on Sep 16, 2016 going ex on Aug 23, 2016",08/23/2016,2021-07-20T00:00:00Z
NVDA.O,ExDividends,"NVDA.Z Interim Cash Dividend of gross USD 0.115 paid on Sep 16, 2016 going ex on Aug 23, 2016",08/23/2016,2021-07-20T00:00:00Z
NVDA.O,ExDividends,"NVDA.B Interim Cash Dividend of gross USD 0.115 paid on Sep 16, 2016 going ex on Aug 23, 2016",08/23/2016,2021-07-20T00:00:00Z
NVDA.O,ConferencePresentations,NVIDIA Corp at Deutsche Bank Technology Conference,09/13/2016,2016-09-13T21:46:20Z
NVDA.O,EarningsReleases,Q3 2017 NVIDIA Corp Earnings Release,11/10/2016,2016-10-27T21:26:55Z
NVDA.O,EarningsCallsAndPresentations,Q3 2017 NVIDIA Corp Earnings Call,11/10/2016,2016-11-14T14:51:50Z
NVDA.O,ExDividends,"NVDAEUR.SGp^L17 Final Cash Dividend of gross USD 0.14 paid on Dec 19, 2016 going ex on Nov 23, 2016",11/23/2016,2021-07-20T00:00:00Z
NVDA.O,ExDividends,"NVDA.DEU Final Cash Dividend of gross USD 0.14 paid on Dec 19, 2016 going ex on Nov 23, 2016",11/23/2016,2021-07-20T00:00:00Z
NVDA.O,ExDividends,"NVDA.TG Final Cash Dividend of gross USD 0.14 paid on Dec 19, 2016 going ex on Nov 23, 2016",11/23/2016,2021-07-20T00:00:00Z
NVDA.O,ExDividends,"NVDA.DY Final Cash Dividend of gross USD 0.14 paid on Dec 19, 2016 going ex on Nov 23, 2016",11/23/2016,2021-07-20T00:00:00Z
NVDA.O,ExDividends,"NVDA.DG Final Cash Dividend of gross USD 0.14 paid on Dec 19, 2016 going ex on Nov 23, 2016",11/23/2016,2021-07-20T00:00:00Z
NVDA.O,ExDividends,"NVDA.PH Final Cash Dividend of gross USD 0.14 paid on Dec 19, 2016 going ex on Nov 23, 2016",11/23/2016,2021-07-20T00:00:00Z
NVDA.O,ExDividends,"NVDA.ZY Final Cash Dividend of gross USD 0.14 paid on Dec 19, 2016 going ex on Nov 23, 2016",11/23/2016,2021-07-20T00:00:00Z
NVDA.O,ExDividends,"NVDA.MX Final Cash Dividend of gross USD 0.14 paid on Dec 19, 2016 going ex on Nov 23, 2016",11/23/2016,2021-07-20T00:00:00Z
NVDA.O,ExDividends,"NVDA.NB Final Cash Dividend of gross USD 0.14 paid on Dec 19, 2016 going ex on Nov 23, 2016",11/23/2016,2021-07-20T00:00:00Z
NVDA.O,ExDividends,"NVDA.BN Final Cash Dividend of gross USD 0.14 paid on Dec 19, 2016 going ex on Nov 23, 2016",11/23/2016,2021-07-20T00:00:00Z
NVDA.O,ExDividends,"NVDA.S Final Cash Dividend of gross USD 0.14 paid on Dec 19, 2016 going ex on Nov 23, 2016",11/23/2016,2021-07-20T00:00:00Z
NVDA.O,ExDividends,"NVDA.EI Final Cash Dividend of gross USD 0.14 paid on Dec 19, 2016 going ex on Nov 23, 2016",11/23/2016,2021-07-20T00:00:00Z
NVDA.O,ExDividends,"NVDA.DF Final Cash Dividend of gross USD 0.14 paid on Dec 19, 2016 going ex on Nov 23, 2016",11/23/2016,2021-07-20T00:00:00Z
NVDA.O,ExDividends,"NVDA.OQ Final Cash Dividend of gross USD 0.14 paid on Dec 19, 2016 going ex on Nov 23, 2016",11/23/2016,2021-07-20T00:00:00Z
NVDA.O,ExDividends,"NVDA.D Final Cash Dividend of gross USD 0.14 paid on Dec 19, 2016 going ex on Nov 23, 2016",11/23/2016,2021-07-20T00:00:00Z
NVDA.O,ExDividends,"NVDA.BE Final Cash Dividend of gross USD 0.14 paid on Dec 19, 2016 going ex on Nov 23, 2016",11/23/2016,2021-07-20T00:00:00Z
NVDA.O,ExDividends,"NVDA.F Final Cash Dividend of gross USD 0.14 paid on Dec 19, 2016 going ex on Nov 23, 2016",11/23/2016,2021-07-20T00:00:00Z
NVDA.O,ExDividends,"NVDA.P Final Cash Dividend of gross USD 0.14 paid on Dec 19, 2016 going ex on Nov 23, 2016",11/23/2016,2021-07-20T00:00:00Z
NVDA.O,ExDividends,"NVDA.MU Final Cash Dividend of gross USD 0.14 paid on Dec 19, 2016 going ex on Nov 23, 2016",11/23/2016,2021-07-20T00:00:00Z
NVDA.O,ExDividends,"NVDA.C Final Cash Dividend of gross USD 0.14 paid on Dec 19, 2016 going ex on Nov 23, 2016",11/23/2016,2021-07-20T00:00:00Z
NVDA.O,ExDividends,"NVDA.MW Final Cash Dividend of gross USD 0.14 paid on Dec 19, 2016 going ex on Nov 23, 2016",11/23/2016,2021-07-20T00:00:00Z
NVDA.O,ExDividends,"NVDA.SG Final Cash Dividend of gross USD 0.14 paid on Dec 19, 2016 going ex on Nov 23, 2016",11/23/2016,2021-07-20T00:00:00Z
NVDA.O,ExDividends,"NVDA.H Final Cash Dividend of gross USD 0.14 paid on Dec 19, 2016 going ex on Nov 23, 2016",11/23/2016,2021-07-20T00:00:00Z
NVDA.O,ExDividends,"NVDA.O Final Cash Dividend of gross USD 0.14 paid on Dec 19, 2016 going ex on Nov 23, 2016",11/23/2016,2021-07-20T00:00:00Z
NVDA.O,ExDividends,"NVDAEUR.DEp^A18 Final Cash Dividend of gross USD 0.14 paid on Dec 19, 2016 going ex on Nov 23, 2016",11/23/2016,2021-07-20T00:00:00Z
NVDA.O,ExDividends,"NVDA.Z Final Cash Dividend of gross USD 0.14 paid on Dec 19, 2016 going ex on Nov 23, 2016",11/23/2016,2021-07-20T00:00:00Z
NVDA.O,ExDividends,"NVDA.B Final Cash Dividend of gross USD 0.14 paid on Dec 19, 2016 going ex on Nov 23, 2016",11/23/2016,2021-07-20T00:00:00Z
NVDA.O,ConferencePresentations,"NVIDIA Corp at Credit Suisse Technology, Media, and Telecom Conference",11/30/2016,2016-12-01T14:55:48Z
NVDA.O,ConferencePresentations,NVIDIA Corp at JPMorgan CES Technology Forum,01/05/2017,2017-01-05T15:25:35Z
NVDA.O,EarningsReleases,Q4 2017 NVIDIA Corp Earnings Release,02/09/2017,2017-01-26T22:49:39Z
NVDA.O,EarningsCallsAndPresentations,Q4 2017 NVIDIA Corp Earnings Call,02/09/2017,2017-02-14T15:44:34Z
NVDA.O,ExDividends,"NVDAEUR.SGp^L17 Interim Cash Dividend of gross USD 0.14 paid on Mar 17, 2017 going ex on Feb 22, 2017",02/22/2017,2021-07-20T00:00:00Z
NVDA.O,ExDividends,"NVDA.DEU Interim Cash Dividend of gross USD 0.14 paid on Mar 17, 2017 going ex on Feb 22, 2017",02/22/2017,2021-07-20T00:00:00Z
NVDA.O,ExDividends,"NVDA.TG Interim Cash Dividend of gross USD 0.14 paid on Mar 17, 2017 going ex on Feb 22, 2017",02/22/2017,2021-07-20T00:00:00Z
NVDA.O,ExDividends,"NVDA.DY Interim Cash Dividend of gross USD 0.14 paid on Mar 17, 2017 going ex on Feb 22, 2017",02/22/2017,2021-07-20T00:00:00Z
NVDA.O,ExDividends,"NVDA.DG Interim Cash Dividend of gross USD 0.14 paid on Mar 17, 2017 going ex on Feb 22, 2017",02/22/2017,2021-07-20T00:00:00Z
NVDA.O,ExDividends,"NVDA.PH Interim Cash Dividend of gross USD 0.14 paid on Mar 17, 2017 going ex on Feb 22, 2017",02/22/2017,2021-07-20T00:00:00Z
NVDA.O,ExDividends,"NVDA.ZY Interim Cash Dividend of gross USD 0.14 paid on Mar 17, 2017 going ex on Feb 22, 2017",02/22/2017,2021-07-20T00:00:00Z
NVDA.O,ExDividends,"NVDA.MX Interim Cash Dividend of gross USD 0.14 paid on Mar 17, 2017 going ex on Feb 22, 2017",02/22/2017,2021-07-20T00:00:00Z
NVDA.O,ExDividends,"NVDA.NB Interim Cash Dividend of gross USD 0.14 paid on Mar 17, 2017 going ex on Feb 22, 2017",02/22/2017,2021-07-20T00:00:00Z
NVDA.O,ExDividends,"NVDA.BN Interim Cash Dividend of gross USD 0.14 paid on Mar 17, 2017 going ex on Feb 22, 2017",02/22/2017,2021-07-20T00:00:00Z
NVDA.O,ExDividends,"NVDA.S Interim Cash Dividend of gross USD 0.14 paid on Mar 17, 2017 going ex on Feb 22, 2017",02/22/2017,2021-07-20T00:00:00Z
NVDA.O,ExDividends,"NVDA.DE Interim Cash Dividend of gross USD 0.14 paid on Mar 17, 2017 going ex on Feb 22, 2017",02/22/2017,2021-07-20T00:00:00Z
NVDA.O,ExDividends,"NVDA.EI Interim Cash Dividend of gross USD 0.14 paid on Mar 17, 2017 going ex on Feb 22, 2017",02/22/2017,2021-07-20T00:00:00Z
NVDA.O,ExDividends,"NVDA.DF Interim Cash Dividend of gross USD 0.14 paid on Mar 17, 2017 going ex on Feb 22, 2017",02/22/2017,2021-07-20T00:00:00Z
NVDA.O,ExDividends,"NVDA.OQ Interim Cash Dividend of gross USD 0.14 paid on Mar 17, 2017 going ex on Feb 22, 2017",02/22/2017,2021-07-20T00:00:00Z
NVDA.O,ExDividends,"NVDA.D Interim Cash Dividend of gross USD 0.14 paid on Mar 17, 2017 going ex on Feb 22, 2017",02/22/2017,2021-07-20T00:00:00Z
NVDA.O,ExDividends,"NVDA.BE Interim Cash Dividend of gross USD 0.14 paid on Mar 17, 2017 going ex on Feb 22, 2017",02/22/2017,2021-07-20T00:00:00Z
NVDA.O,ExDividends,"NVDA.F Interim Cash Dividend of gross USD 0.14 paid on Mar 17, 2017 going ex on Feb 22, 2017",02/22/2017,2021-07-20T00:00:00Z
NVDA.O,ExDividends,"NVDA.P Interim Cash Dividend of gross USD 0.14 paid on Mar 17, 2017 going ex on Feb 22, 2017",02/22/2017,2021-07-20T00:00:00Z
NVDA.O,ExDividends,"NVDA.MU Interim Cash Dividend of gross USD 0.14 paid on Mar 17, 2017 going ex on Feb 22, 2017",02/22/2017,2021-07-20T00:00:00Z
NVDA.O,ExDividends,"NVDA.C Interim Cash Dividend of gross USD 0.14 paid on Mar 17, 2017 going ex on Feb 22, 2017",02/22/2017,2021-07-20T00:00:00Z
NVDA.O,ExDividends,"NVDA.MW Interim Cash Dividend of gross USD 0.14 paid on Mar 17, 2017 going ex on Feb 22, 2017",02/22/2017,2021-07-20T00:00:00Z
NVDA.O,ExDividends,"NVDA.SG Interim Cash Dividend of gross USD 0.14 paid on Mar 17, 2017 going ex on Feb 22, 2017",02/22/2017,2021-07-20T00:00:00Z
NVDA.O,ExDividends,"NVDA.H Interim Cash Dividend of gross USD 0.14 paid on Mar 17, 2017 going ex on Feb 22, 2017",02/22/2017,2021-07-20T00:00:00Z
NVDA.O,ExDividends,"NVDA.O Interim Cash Dividend of gross USD 0.14 paid on Mar 17, 2017 going ex on Feb 22, 2017",02/22/2017,2021-07-20T00:00:00Z
NVDA.O,ExDividends,"NVDAEUR.DEp^A18 Interim Cash Dividend of gross USD 0.14 paid on Mar 17, 2017 going ex on Feb 22, 2017",02/22/2017,2021-07-20T00:00:00Z
NVDA.O,ExDividends,"NVDA.Z Interim Cash Dividend of gross USD 0.14 paid on Mar 17, 2017 going ex on Feb 22, 2017",02/22/2017,2021-07-20T00:00:00Z
NVDA.O,ExDividends,"NVDA.B Interim Cash Dividend of gross USD 0.14 paid on Mar 17, 2017 going ex on Feb 22, 2017",02/22/2017,2021-07-20T00:00:00Z
NVDA.O,ConferencePresentations,"NVIDIA Corp at Morgan Stanley Technology, Media & Telecom Conference",03/01/2017,2017-03-02T01:59:34Z
NVDA.O,ConferencePresentations,NVIDIA Corp at Raymond James Institutional Investors Conference,03/06/2017,2018-04-10T20:05:44Z
NVDA.O,ConferencePresentations,NVIDIA Corp at Mitsubishi UFJ Securities Tech Tour - Silicon Valley,03/07/2017,2017-03-02T12:35:05Z
NVDA.O,EarningsReleases,Q1 2018 NVIDIA Corp Earnings Release,05/09/2017,2017-04-05T21:54:06Z
NVDA.O,EarningsCallsAndPresentations,Q1 2018 NVIDIA Corp Earnings Call,05/09/2017,2017-05-15T18:41:56Z
NVDA.O,CorporateAnalystMeetings,NVIDIA Corp Investor Day,05/10/2017,2017-05-20T10:01:39Z
NVDA.O,ConferencePresentations,NVIDIA Corp at Deutsche Bank AutoTech Conference,05/11/2017,2017-05-11T15:57:20Z
NVDA.O,ExDividends,"NVDAEUR.SGp^L17 Interim Cash Dividend of gross USD 0.14 paid on Jun 14, 2017 going ex on May 19, 2017",05/19/2017,2021-07-20T00:00:00Z
NVDA.O,ExDividends,"NVDA.DEU Interim Cash Dividend of gross USD 0.14 paid on Jun 14, 2017 going ex on May 19, 2017",05/19/2017,2021-07-20T00:00:00Z
NVDA.O,ExDividends,"NVDA.TG Interim Cash Dividend of gross USD 0.14 paid on Jun 14, 2017 going ex on May 19, 2017",05/19/2017,2021-07-20T00:00:00Z
NVDA.O,ExDividends,"NVDA.DY Interim Cash Dividend of gross USD 0.14 paid on Jun 14, 2017 going ex on May 19, 2017",05/19/2017,2021-07-20T00:00:00Z
NVDA.O,ExDividends,"NVDA.DG Interim Cash Dividend of gross USD 0.14 paid on Jun 14, 2017 going ex on May 19, 2017",05/19/2017,2021-07-20T00:00:00Z
NVDA.O,ExDividends,"NVDA.PH Interim Cash Dividend of gross USD 0.14 paid on Jun 14, 2017 going ex on May 19, 2017",05/19/2017,2021-07-20T00:00:00Z
NVDA.O,ExDividends,"NVDA.ZY Interim Cash Dividend of gross USD 0.14 paid on Jun 14, 2017 going ex on May 19, 2017",05/19/2017,2021-07-20T00:00:00Z
NVDA.O,ExDividends,"NVDA.MX Interim Cash Dividend of gross USD 0.14 paid on Jun 14, 2017 going ex on May 19, 2017",05/19/2017,2021-07-20T00:00:00Z
NVDA.O,ExDividends,"NVDA.NB Interim Cash Dividend of gross USD 0.14 paid on Jun 14, 2017 going ex on May 19, 2017",05/19/2017,2021-07-20T00:00:00Z
NVDA.O,ExDividends,"NVDA.BN Interim Cash Dividend of gross USD 0.14 paid on Jun 14, 2017 going ex on May 19, 2017",05/19/2017,2021-07-20T00:00:00Z
NVDA.O,ExDividends,"NVDA.S Interim Cash Dividend of gross USD 0.14 paid on Jun 14, 2017 going ex on May 19, 2017",05/19/2017,2021-07-20T00:00:00Z
NVDA.O,ExDividends,"NVDA.DE Interim Cash Dividend of gross USD 0.14 paid on Jun 14, 2017 going ex on May 19, 2017",05/19/2017,2021-07-20T00:00:00Z
NVDA.O,ExDividends,"NVDA.EI Interim Cash Dividend of gross USD 0.14 paid on Jun 14, 2017 going ex on May 19, 2017",05/19/2017,2021-07-20T00:00:00Z
NVDA.O,ExDividends,"NVDA.DF Interim Cash Dividend of gross USD 0.14 paid on Jun 14, 2017 going ex on May 19, 2017",05/19/2017,2021-07-20T00:00:00Z
NVDA.O,ExDividends,"NVDA.OQ Interim Cash Dividend of gross USD 0.14 paid on Jun 14, 2017 going ex on May 19, 2017",05/19/2017,2021-07-20T00:00:00Z
NVDA.O,ExDividends,"NVDA.D Interim Cash Dividend of gross USD 0.14 paid on Jun 14, 2017 going ex on May 19, 2017",05/19/2017,2021-07-20T00:00:00Z
NVDA.O,ExDividends,"NVDA.BE Interim Cash Dividend of gross USD 0.14 paid on Jun 14, 2017 going ex on May 19, 2017",05/19/2017,2021-07-20T00:00:00Z
NVDA.O,ExDividends,"NVDA.F Interim Cash Dividend of gross USD 0.14 paid on Jun 14, 2017 going ex on May 19, 2017",05/19/2017,2021-07-20T00:00:00Z
NVDA.O,ExDividends,"NVDA.P Interim Cash Dividend of gross USD 0.14 paid on Jun 14, 2017 going ex on May 19, 2017",05/19/2017,2021-07-20T00:00:00Z
NVDA.O,ExDividends,"NVDA.MU Interim Cash Dividend of gross USD 0.14 paid on Jun 14, 2017 going ex on May 19, 2017",05/19/2017,2021-07-20T00:00:00Z
NVDA.O,ExDividends,"NVDA.C Interim Cash Dividend of gross USD 0.14 paid on Jun 14, 2017 going ex on May 19, 2017",05/19/2017,2021-07-20T00:00:00Z
NVDA.O,ExDividends,"NVDA.MW Interim Cash Dividend of gross USD 0.14 paid on Jun 14, 2017 going ex on May 19, 2017",05/19/2017,2021-07-20T00:00:00Z
NVDA.O,ExDividends,"NVDA.SG Interim Cash Dividend of gross USD 0.14 paid on Jun 14, 2017 going ex on May 19, 2017",05/19/2017,2021-07-20T00:00:00Z
NVDA.O,ExDividends,"NVDA.H Interim Cash Dividend of gross USD 0.14 paid on Jun 14, 2017 going ex on May 19, 2017",05/19/2017,2021-07-20T00:00:00Z
NVDA.O,ExDividends,"NVDA.O Interim Cash Dividend of gross USD 0.14 paid on Jun 14, 2017 going ex on May 19, 2017",05/19/2017,2021-07-20T00:00:00Z
NVDA.O,ExDividends,"NVDAEUR.DEp^A18 Interim Cash Dividend of gross USD 0.14 paid on Jun 14, 2017 going ex on May 19, 2017",05/19/2017,2021-07-20T00:00:00Z
NVDA.O,ExDividends,"NVDA.Z Interim Cash Dividend of gross USD 0.14 paid on Jun 14, 2017 going ex on May 19, 2017",05/19/2017,2021-07-20T00:00:00Z
NVDA.O,ExDividends,"NVDA.B Interim Cash Dividend of gross USD 0.14 paid on Jun 14, 2017 going ex on May 19, 2017",05/19/2017,2021-07-20T00:00:00Z
NVDA.O,ConferencePresentations,"NVIDIA Corp at JPMorgan Tech, Media and Telecom Conference",05/22/2017,2017-05-25T15:56:31Z
NVDA.O,ShareholderAndAnnualMeetings,NVIDIA Corp Annual Shareholders Meeting,05/23/2017,2017-09-27T07:43:37Z
NVDA.O,ConferencePresentations,NVIDIA Corp at Bank of America Merrill Lynch Global Technology Conference,06/06/2017,2017-06-07T07:06:17Z
NVDA.O,ConferencePresentations,NVIDIA Corp at Nasdaq Investor Program,06/15/2017,2017-06-16T00:11:22Z
NVDA.O,EarningsReleases,Q2 2018 NVIDIA Corp Earnings Release,08/10/2017,2017-07-27T21:05:36Z
NVDA.O,EarningsCallsAndPresentations,Q2 2018 NVIDIA Corp Earnings Call,08/10/2017,2017-08-15T03:33:16Z
NVDA.O,ExDividends,"NVDAEUR.SGp^L17 Interim Cash Dividend of gross USD 0.14 paid on Sep 18, 2017 going ex on Aug 22, 2017",08/22/2017,2021-07-20T00:00:00Z
NVDA.O,ExDividends,"NVDA.DEU Interim Cash Dividend of gross USD 0.14 paid on Sep 18, 2017 going ex on Aug 22, 2017",08/22/2017,2021-07-20T00:00:00Z
NVDA.O,ExDividends,"NVDA.TG Interim Cash Dividend of gross USD 0.14 paid on Sep 18, 2017 going ex on Aug 22, 2017",08/22/2017,2021-07-20T00:00:00Z
NVDA.O,ExDividends,"NVDA.DY Interim Cash Dividend of gross USD 0.14 paid on Sep 18, 2017 going ex on Aug 22, 2017",08/22/2017,2021-07-20T00:00:00Z
NVDA.O,ExDividends,"NVDA.DG Interim Cash Dividend of gross USD 0.14 paid on Sep 18, 2017 going ex on Aug 22, 2017",08/22/2017,2021-07-20T00:00:00Z
NVDA.O,ExDividends,"NVDA.PH Interim Cash Dividend of gross USD 0.14 paid on Sep 18, 2017 going ex on Aug 22, 2017",08/22/2017,2021-07-20T00:00:00Z
NVDA.O,ExDividends,"NVDA.ZY Interim Cash Dividend of gross USD 0.14 paid on Sep 18, 2017 going ex on Aug 22, 2017",08/22/2017,2021-07-20T00:00:00Z
NVDA.O,ExDividends,"NVDA.MX Interim Cash Dividend of gross USD 0.14 paid on Sep 18, 2017 going ex on Aug 22, 2017",08/22/2017,2021-07-20T00:00:00Z
NVDA.O,ExDividends,"NVDA.NB Interim Cash Dividend of gross USD 0.14 paid on Sep 18, 2017 going ex on Aug 22, 2017",08/22/2017,2021-07-20T00:00:00Z
NVDA.O,ExDividends,"NVDA.BN Interim Cash Dividend of gross USD 0.14 paid on Sep 18, 2017 going ex on Aug 22, 2017",08/22/2017,2021-07-20T00:00:00Z
NVDA.O,ExDividends,"NVDA.S Interim Cash Dividend of gross USD 0.14 paid on Sep 18, 2017 going ex on Aug 22, 2017",08/22/2017,2021-07-20T00:00:00Z
NVDA.O,ExDividends,"NVDA.DE Interim Cash Dividend of gross USD 0.14 paid on Sep 18, 2017 going ex on Aug 22, 2017",08/22/2017,2021-07-20T00:00:00Z
NVDA.O,ExDividends,"NVDA.VI Interim Cash Dividend of gross USD 0.14 paid on Sep 18, 2017 going ex on Aug 22, 2017",08/22/2017,2021-07-20T00:00:00Z
NVDA.O,ExDividends,"NVDA.VIf Interim Cash Dividend of gross USD 0.14 paid on Sep 18, 2017 going ex on Aug 22, 2017",08/22/2017,2021-07-20T00:00:00Z
NVDA.O,ExDividends,"NVDA.EI Interim Cash Dividend of gross USD 0.14 paid on Sep 18, 2017 going ex on Aug 22, 2017",08/22/2017,2021-07-20T00:00:00Z
